ALERT_780,164.103.61.72,http://jones.com/,Leave former control lay.,"Mozilla/5.0 (Linux; Android 3.1) AppleWebKit/532.2 (KHTML, like Gecko) Chrome/62.0.849.0 Safari/532.2",404,Russian Federation,Blind SQLi,7,1,26,TP,Since effect ball everybody add mother election collection.,13,6,1.0,0.0,0.0,0.0,0.0,1.0,0.0
ALERT_781,74.252.13.25,http://martinez.biz/,Others certain keep meeting difficult.,Mozilla/5.0 (compatible; MSIE 6.0; Windows NT 11.0; Trident/4.0),500,Bahrain,Blind SQLi,1,2,56,FP,,13,6,1.0,0.0,0.0,0.0,0.0,1.0,0.0
ALERT_782,36.180.252.62,https://martinez-howard.net/,Other employee method office onto.,"Mozilla/5.0 (Windows; U; Windows 98) AppleWebKit/535.41.3 (KHTML, like Gecko) Version/5.0.3 Safari/535.41.3",200,United States Minor Outlying Islands,Stored XSS,4,3,38,TP,,13,6,0.0,0.0,1.0,0.0,0.0,0.0,1.0
ALERT_783,194.205.219.223,https://www.hughes-walker.com/,Usually car parent onto but without much.,Mozilla/5.0 (compatible; MSIE 6.0; Windows NT 6.1; Trident/4.0),200,Moldova,Stored XSS,9,4,26,TP,Can song fast radio.,13,6,1.0,0.0,0.0,0.0,0.0,0.0,1.0
ALERT_784,144.113.221.27,https://www.hogan.com/,Mean them six instead.,Mozilla/5.0 (X11; Linux i686; rv:1.9.7.20) Gecko/3343-05-23 03:18:11 Firefox/5.0,500,Romania,Stored XSS,4,2,15,FP,,13,6,1.0,0.0,0.0,0.0,1.0,0.0,0.0
ALERT_785,118.252.82.0,http://fields.com/,True I step particular more.,Mozilla/5.0 (Macintosh; U; PPC Mac OS X 10_11_8; rv:1.9.3.20) Gecko/3334-09-29 21:33:08 Firefox/3.8,200,Cambodia,Blind SQLi,6,3,35,FP,,13,6,0.0,1.0,0.0,0.0,1.0,0.0,0.0
ALERT_786,191.63.54.165,https://www.downs.com/,Friend still field reveal room.,Mozilla/5.0 (compatible; MSIE 7.0; Windows NT 5.01; Trident/4.1),500,Lebanon,Blind SQLi,2,1,24,FP,House notice something ago.,13,6,0.0,1.0,0.0,0.0,0.0,0.0,1.0
ALERT_787,36.198.63.16,http://thomas-lee.biz/,Suggest girl explain fear.,Mozilla/5.0 (Macintosh; PPC Mac OS X 10_12_5; rv:1.9.2.20) Gecko/8092-05-12 14:26:18 Firefox/3.6.2,500,Cote d'Ivoire,Stored XSS,9,1,53,FP,,13,6,1.0,0.0,0.0,0.0,1.0,0.0,0.0
ALERT_788,63.178.200.188,http://harding.com/,Memory poor discuss space role tend product.,"Mozilla/5.0 (Windows; U; Windows NT 5.1) AppleWebKit/531.22.7 (KHTML, like Gecko) Version/4.0.4 Safari/531.22.7",500,Svalbard & Jan Mayen Islands,Stored XSS,9,2,34,FP,Certain answer great civil keep.,13,6,0.0,1.0,0.0,0.0,1.0,0.0,0.0
ALERT_789,165.200.233.219,https://www.edwards.com/,Peace democratic PM enjoy hear you quite offer.,"Mozilla/5.0 (iPod; U; CPU iPhone OS 3_0 like Mac OS X; cmn-TW) AppleWebKit/534.38.3 (KHTML, like Gecko) Version/3.0.5 Mobile/8B117 Safari/6534.38.3",200,Marshall Islands,Blind SQLi,8,1,48,FP,Apply decision care present group much group.,13,6,0.0,0.0,1.0,0.0,0.0,0.0,1.0
ALERT_790,223.85.163.187,https://www.olsen.com/,Describe newspaper wall follow.,"Mozilla/5.0 (Linux; Android 4.4) AppleWebKit/534.2 (KHTML, like Gecko) Chrome/62.0.814.0 Safari/534.2",404,Heard Island and McDonald Islands,Blind SQLi,2,3,54,TP,Skill when reach surface.,13,6,0.0,0.0,0.0,1.0,0.0,1.0,0.0
ALERT_791,58.99.34.254,https://bartlett.com/,Drop last person.,Mozilla/5.0 (compatible; MSIE 7.0; Windows 98; Trident/3.0),500,Syrian Arab Republic,Stored XSS,6,3,15,FP,,13,6,1.0,0.0,0.0,0.0,0.0,1.0,0.0
ALERT_792,80.178.139.104,http://wade.net/,Both option beautiful tend a visit lead.,Opera/9.55.(Windows NT 6.0; nb-NO) Presto/2.9.189 Version/12.00,404,Belarus,Stored XSS,3,3,59,FP,,13,6,0.0,1.0,0.0,0.0,0.0,0.0,1.0
ALERT_793,48.82.120.195,https://thomas.net/,Short ahead year describe enjoy trip summer.,"Mozilla/5.0 (iPod; U; CPU iPhone OS 4_2 like Mac OS X; fo-FO) AppleWebKit/535.9.6 (KHTML, like Gecko) Version/4.0.5 Mobile/8B111 Safari/6535.9.6",404,Luxembourg,Blind SQLi,9,4,37,FP,,13,6,1.0,0.0,0.0,0.0,0.0,1.0,0.0
ALERT_794,159.54.110.252,https://banks-warner.com/,But employee though sometimes water.,"Mozilla/5.0 (Macintosh; U; PPC Mac OS X 10_5_4 rv:5.0; yi-US) AppleWebKit/531.4.7 (KHTML, like Gecko) Version/5.0 Safari/531.4.7",500,North Macedonia,Stored XSS,3,3,18,TP,Rather open site begin.,13,6,1.0,0.0,0.0,0.0,0.0,1.0,0.0
ALERT_795,102.137.203.76,https://www.underwood-joseph.info/,Decade open ever need on coach.,Opera/9.53.(Windows NT 5.0; lv-LV) Presto/2.9.172 Version/11.00,200,Philippines,Stored XSS,1,2,30,TP,,13,6,0.0,0.0,0.0,1.0,0.0,1.0,0.0
ALERT_796,123.81.168.54,http://www.nash.com/,They everything car mean a traditional marriage.,"Mozilla/5.0 (iPod; U; CPU iPhone OS 4_3 like Mac OS X; ga-IE) AppleWebKit/533.36.6 (KHTML, like Gecko) Version/4.0.5 Mobile/8B116 Safari/6533.36.6",500,Kiribati,Stored XSS,8,1,9,TP,,13,6,1.0,0.0,0.0,0.0,0.0,1.0,0.0
ALERT_797,56.115.62.191,https://chambers.info/,Until eight other whose easy chance candidate.,Mozilla/5.0 (compatible; MSIE 6.0; Windows NT 5.0; Trident/5.0),200,Turks and Caicos Islands,Blind SQLi,6,1,12,FP,,13,6,0.0,1.0,0.0,0.0,1.0,0.0,0.0
ALERT_798,68.208.136.94,https://www.alexander-curtis.net/,Bill maybe without any. Street care nation ever.,"Mozilla/5.0 (Macintosh; U; PPC Mac OS X 10_9_7 rv:4.0; ja-JP) AppleWebKit/531.16.5 (KHTML, like Gecko) Version/5.1 Safari/531.16.5",404,Bouvet Island (Bouvetoya),Blind SQLi,6,1,7,TP,Player move range these sell place politics.,13,6,0.0,1.0,0.0,0.0,0.0,1.0,0.0
ALERT_799,113.194.158.123,http://www.smith.com/,After decade size name.,"Mozilla/5.0 (Windows 98; Win 9x 4.90) AppleWebKit/531.2 (KHTML, like Gecko) Chrome/31.0.812.0 Safari/531.2",200,Bermuda,Blind SQLi,5,3,3,FP,Population usually increase conference good discover.,13,6,0.0,0.0,0.0,1.0,0.0,0.0,1.0
ALERT_800,57.74.209.232,https://burns.info/,His own five game with show.,Opera/8.20.(Windows 95; unm-US) Presto/2.9.164 Version/10.00,404,Denmark,Blind SQLi,9,1,46,FP,,13,6,0.0,1.0,0.0,0.0,0.0,0.0,1.0
ALERT_801,117.129.230.159,https://bush-smith.com/,Write red north series.,Mozilla/5.0 (Macintosh; PPC Mac OS X 10_9_1; rv:1.9.5.20) Gecko/6247-05-05 15:24:43 Firefox/11.0,500,Mali,Blind SQLi,1,3,2,FP,Example suffer other find.,13,6,0.0,0.0,0.0,1.0,0.0,0.0,1.0
ALERT_802,179.209.65.243,http://www.hill.com/,Hundred find mind each report husband star.,"Mozilla/5.0 (Linux; Android 3.2.2) AppleWebKit/535.0 (KHTML, like Gecko) Chrome/14.0.827.0 Safari/535.0",200,Maldives,Blind SQLi,1,4,4,TP,,13,6,0.0,0.0,1.0,0.0,0.0,0.0,1.0
ALERT_803,210.155.236.247,http://www.walker.com/,Cultural under rule.,"Mozilla/5.0 (Macintosh; PPC Mac OS X 10_11_1 rv:6.0; lt-LT) AppleWebKit/535.39.3 (KHTML, like Gecko) Version/4.0 Safari/535.39.3",500,Cyprus,Stored XSS,5,4,21,FP,Question south bill paper.,13,6,0.0,1.0,0.0,0.0,0.0,0.0,1.0
ALERT_804,21.172.52.242,http://garza.com/,Police successful more dog trouble design.,"Mozilla/5.0 (X11; Linux i686) AppleWebKit/536.1 (KHTML, like Gecko) Chrome/51.0.862.0 Safari/536.1",404,Ecuador,Blind SQLi,5,4,42,FP,,13,6,1.0,0.0,0.0,0.0,0.0,0.0,1.0
ALERT_805,8.94.124.105,https://chapman-morgan.com/,Democratic among travel leg firm.,"Mozilla/5.0 (Macintosh; Intel Mac OS X 10_5_6 rv:3.0; pa-PK) AppleWebKit/532.22.3 (KHTML, like Gecko) Version/5.1 Safari/532.22.3",404,Panama,Blind SQLi,3,1,16,FP,,13,6,0.0,0.0,1.0,0.0,1.0,0.0,0.0
ALERT_806,61.177.84.161,https://sanders.com/,Still guess per good actually station.,"Mozilla/5.0 (Macintosh; U; PPC Mac OS X 10_9_3 rv:6.0; tcy-IN) AppleWebKit/531.18.1 (KHTML, like Gecko) Version/5.0.1 Safari/531.18.1",404,Australia,Blind SQLi,3,1,53,FP,Cause quite again wall TV mean already.,13,6,0.0,1.0,0.0,0.0,0.0,0.0,1.0
ALERT_807,129.92.98.118,http://peterson.com/,Bring traditional upon impact.,Mozilla/5.0 (compatible; MSIE 9.0; Windows CE; Trident/4.1),403,Kiribati,Blind SQLi,3,4,2,TP,Structure economic great still civil action.,13,6,0.0,0.0,1.0,0.0,1.0,0.0,0.0
ALERT_808,142.17.117.110,http://brown-henry.com/,Become from final author bring lawyer set.,Opera/8.99.(X11; Linux x86_64; st-ZA) Presto/2.9.185 Version/10.00,500,Austria,Stored XSS,6,2,22,TP,,13,6,0.0,0.0,1.0,0.0,1.0,0.0,0.0
ALERT_809,157.171.111.211,https://charles-gray.com/,This statement future force first PM man carry.,Opera/8.85.(Windows NT 5.2; pap-AW) Presto/2.9.174 Version/11.00,403,Honduras,Blind SQLi,5,3,57,TP,Most now upon maybe shake down.,13,6,0.0,0.0,0.0,1.0,0.0,1.0,0.0
ALERT_810,214.116.75.22,https://www.johnson-herrera.com/,Report style particular including consider and.,Mozilla/5.0 (Windows NT 6.2; sid-ET; rv:1.9.2.20) Gecko/3219-01-25 10:24:41 Firefox/3.6.2,200,Macao,Stored XSS,3,2,12,FP,Wait worry price every here tree.,13,6,0.0,1.0,0.0,0.0,0.0,1.0,0.0
ALERT_811,125.231.210.3,https://smith.com/,Debate week do sort pay character politics.,"Mozilla/5.0 (Macintosh; PPC Mac OS X 10_11_9 rv:5.0; cv-RU) AppleWebKit/533.34.1 (KHTML, like Gecko) Version/4.0.4 Safari/533.34.1",500,Ecuador,Blind SQLi,6,4,26,TP,,13,6,0.0,0.0,1.0,0.0,1.0,0.0,0.0
ALERT_812,109.13.181.156,https://miller.org/,Education audience run care somebody.,Mozilla/5.0 (compatible; MSIE 5.0; Windows NT 11.0; Trident/5.1),200,Solomon Islands,Blind SQLi,3,4,57,TP,Writer natural cause drug operation miss.,13,6,0.0,0.0,1.0,0.0,0.0,1.0,0.0
ALERT_813,111.54.245.154,https://adams.com/,Raise final from morning great.,Mozilla/5.0 (compatible; MSIE 5.0; Windows 95; Trident/4.0),403,American Samoa,Blind SQLi,7,4,33,FP,Building nation hospital claim hair.,13,6,1.0,0.0,0.0,0.0,0.0,0.0,1.0
ALERT_814,220.160.166.168,http://www.webster.net/,Recent grow task throughout PM create show.,"Mozilla/5.0 (X11; Linux i686) AppleWebKit/536.1 (KHTML, like Gecko) Chrome/61.0.853.0 Safari/536.1",404,Botswana,Stored XSS,9,2,5,FP,Participant notice paper bed week into investment morning.,13,6,0.0,1.0,0.0,0.0,0.0,0.0,1.0
ALERT_815,14.3.12.213,https://garcia.com/,Bank use wide next beat.,Opera/8.56.(Windows CE; da-DK) Presto/2.9.188 Version/12.00,200,New Caledonia,Stored XSS,3,1,48,TP,Natural fear poor realize.,13,6,0.0,0.0,1.0,0.0,1.0,0.0,0.0
ALERT_816,159.152.161.25,https://reyes.com/,Record idea move recently tend future view.,"Mozilla/5.0 (iPod; U; CPU iPhone OS 4_3 like Mac OS X; nds-DE) AppleWebKit/531.25.7 (KHTML, like Gecko) Version/3.0.5 Mobile/8B118 Safari/6531.25.7",200,American Samoa,Stored XSS,1,1,51,FP,Attack price girl.,13,6,0.0,0.0,1.0,0.0,0.0,1.0,0.0
ALERT_817,191.11.20.38,http://montoya-dickson.org/,Include or father near seven.,"Mozilla/5.0 (Windows CE) AppleWebKit/534.2 (KHTML, like Gecko) Chrome/17.0.875.0 Safari/534.2",403,Latvia,Stored XSS,2,3,58,FP,,13,6,1.0,0.0,0.0,0.0,0.0,1.0,0.0
ALERT_818,90.185.140.101,http://ellis.biz/,Any up deep Congress side fish take.,Mozilla/5.0 (compatible; MSIE 5.0; Windows NT 6.1; Trident/4.0),403,Switzerland,Stored XSS,4,2,20,FP,,13,6,0.0,0.0,1.0,0.0,0.0,0.0,1.0
ALERT_819,117.165.230.136,http://www.bentley.org/,Fall choose thousand save between serve.,"Mozilla/5.0 (Macintosh; U; Intel Mac OS X 10_9_3 rv:5.0; my-MM) AppleWebKit/532.43.5 (KHTML, like Gecko) Version/4.0 Safari/532.43.5",200,Saint Pierre and Miquelon,Stored XSS,7,4,2,TP,,13,6,0.0,0.0,1.0,0.0,0.0,0.0,1.0
ALERT_820,98.170.175.130,http://mays.com/,Debate watch grow case suffer first.,"Mozilla/5.0 (Macintosh; Intel Mac OS X 10_6_0 rv:6.0; fur-IT) AppleWebKit/535.29.2 (KHTML, like Gecko) Version/5.0 Safari/535.29.2",403,Namibia,Blind SQLi,4,4,56,TP,,13,6,0.0,0.0,0.0,1.0,0.0,0.0,1.0
ALERT_821,138.248.40.34,http://robinson.info/,Story easy writer blue firm dark gun.,"Mozilla/5.0 (iPad; CPU iPad OS 12_5_7 like Mac OS X) AppleWebKit/535.1 (KHTML, like Gecko) CriOS/25.0.884.0 Mobile/37D957 Safari/535.1",403,Tanzania,Stored XSS,7,2,6,TP,,13,6,0.0,0.0,0.0,1.0,0.0,0.0,1.0
ALERT_822,21.122.189.197,http://www.jones.com/,Article impact owner federal big.,"Mozilla/5.0 (Macintosh; PPC Mac OS X 10_12_9) AppleWebKit/533.1 (KHTML, like Gecko) Chrome/52.0.830.0 Safari/533.1",404,Mauritania,Blind SQLi,6,4,39,FP,Seven Congress and them option.,13,6,0.0,0.0,1.0,0.0,0.0,1.0,0.0
ALERT_823,159.217.24.143,https://brooks-salazar.info/,Organization during state anyone score force.,"Mozilla/5.0 (Windows; U; Windows NT 6.2) AppleWebKit/535.13.7 (KHTML, like Gecko) Version/5.0.1 Safari/535.13.7",404,Samoa,Blind SQLi,7,3,29,FP,Student traditional account want unit wall worry.,13,6,1.0,0.0,0.0,0.0,0.0,0.0,1.0
ALERT_824,102.239.209.86,http://kennedy.net/,Responsibility work about agreement.,Opera/9.13.(X11; Linux i686; mt-MT) Presto/2.9.161 Version/10.00,500,Montenegro,Stored XSS,3,4,13,FP,,13,6,0.0,1.0,0.0,0.0,1.0,0.0,0.0
ALERT_825,112.24.156.118,http://gonzales.info/,Whose education must it.,Mozilla/5.0 (Macintosh; U; PPC Mac OS X 10_5_9; rv:1.9.2.20) Gecko/6085-06-29 15:48:55 Firefox/12.0,500,New Zealand,Stored XSS,7,4,16,FP,Able usually measure less like site south dinner.,13,6,0.0,0.0,1.0,0.0,0.0,1.0,0.0
ALERT_826,18.123.78.214,http://ryan.net/,Single I whole manage without among.,Opera/8.67.(X11; Linux x86_64; sid-ET) Presto/2.9.172 Version/10.00,200,Maldives,Blind SQLi,6,4,16,TP,Decide design charge grow.,13,6,1.0,0.0,0.0,0.0,0.0,0.0,1.0
ALERT_827,4.98.15.219,https://www.owens.info/,American rest experience allow. Tax market civil.,Mozilla/5.0 (Android 3.2; Mobile; rv:9.0) Gecko/9.0 Firefox/9.0,200,Austria,Stored XSS,4,4,40,FP,Letter various popular compare the.,13,6,0.0,0.0,1.0,0.0,0.0,1.0,0.0
ALERT_828,88.41.50.194,https://www.davis.com/,Wide fire area. Popular poor growth represent.,Opera/9.27.(Windows 95; sw-TZ) Presto/2.9.185 Version/11.00,403,Brazil,Blind SQLi,9,4,40,FP,,13,6,0.0,1.0,0.0,0.0,0.0,1.0,0.0
ALERT_829,145.45.57.223,http://hensley.com/,Together middle parent trouble.,"Mozilla/5.0 (iPad; CPU iPad OS 17_1 like Mac OS X) AppleWebKit/534.0 (KHTML, like Gecko) FxiOS/16.1u7752.0 Mobile/86J363 Safari/534.0",500,Slovenia,Blind SQLi,1,4,27,FP,,13,6,0.0,0.0,0.0,1.0,0.0,1.0,0.0
ALERT_830,12.45.84.48,https://www.jackson.com/,War civil main your.,Mozilla/5.0 (Android 8.0.0; Mobile; rv:49.0) Gecko/49.0 Firefox/49.0,200,Indonesia,Stored XSS,2,2,26,FP,,13,6,1.0,0.0,0.0,0.0,0.0,1.0,0.0
ALERT_831,76.53.221.211,http://www.cooper.com/,Organization computer drop pressure hospital.,Opera/8.39.(X11; Linux x86_64; or-IN) Presto/2.9.183 Version/12.00,404,Lao People's Democratic Republic,Stored XSS,2,3,13,FP,Give power itself walk director.,13,6,0.0,1.0,0.0,0.0,0.0,0.0,1.0
ALERT_832,138.82.229.61,http://www.meyers-hatfield.info/,Century identify partner in song me.,Mozilla/5.0 (X11; Linux x86_64; rv:1.9.6.20) Gecko/3496-12-26 19:48:22 Firefox/8.0,403,Greenland,Stored XSS,2,3,27,TP,,13,6,0.0,0.0,0.0,1.0,1.0,0.0,0.0
ALERT_833,128.247.150.185,https://www.rogers.com/,Green ago item budget couple look black option.,Opera/8.46.(Windows NT 4.0; ig-NG) Presto/2.9.170 Version/11.00,403,Germany,Stored XSS,6,3,49,FP,Try against interest share find stage.,13,6,0.0,0.0,1.0,0.0,1.0,0.0,0.0
ALERT_834,153.3.15.91,https://rosales-johnson.com/,Task employee let parent save.,Mozilla/5.0 (compatible; MSIE 7.0; Windows NT 5.2; Trident/5.0),404,American Samoa,Blind SQLi,9,3,42,FP,,13,6,1.0,0.0,0.0,0.0,0.0,0.0,1.0
ALERT_835,63.216.209.14,http://www.davis.com/,Exist major receive anything run democratic.,"Mozilla/5.0 (Windows; U; Windows 98; Win 9x 4.90) AppleWebKit/533.10.4 (KHTML, like Gecko) Version/4.0 Safari/533.10.4",200,Togo,Blind SQLi,1,2,56,FP,Look especially check worker yet.,13,6,0.0,1.0,0.0,0.0,0.0,0.0,1.0
ALERT_836,43.186.97.81,http://wells-young.com/,Reveal near deep himself above ground.,"Mozilla/5.0 (iPhone; CPU iPhone OS 12_4_4 like Mac OS X) AppleWebKit/531.0 (KHTML, like Gecko) FxiOS/14.8k7901.0 Mobile/88O965 Safari/531.0",403,French Guiana,Stored XSS,7,4,54,TP,,13,6,1.0,0.0,0.0,0.0,1.0,0.0,0.0
ALERT_837,152.31.43.153,http://www.burgess.com/,Oil fall one high color nation certain.,Mozilla/5.0 (compatible; MSIE 5.0; Windows NT 6.1; Trident/3.1),500,Costa Rica,Stored XSS,2,1,4,FP,All interest once morning guess audience effect.,13,6,0.0,1.0,0.0,0.0,1.0,0.0,0.0
ALERT_838,107.84.112.182,http://www.burke.com/,Education parent full. Get consumer win store.,"Mozilla/5.0 (Windows; U; Windows NT 5.1) AppleWebKit/534.41.4 (KHTML, like Gecko) Version/5.0.4 Safari/534.41.4",200,United States of America,Stored XSS,9,2,38,FP,Where performance support rise painting.,13,6,0.0,0.0,0.0,1.0,0.0,0.0,1.0
ALERT_839,6.45.91.24,https://scott.net/,We tell foreign blood. Nearly into himself know.,"Mozilla/5.0 (Macintosh; Intel Mac OS X 10_5_8 rv:5.0; uk-UA) AppleWebKit/534.44.7 (KHTML, like Gecko) Version/4.0.2 Safari/534.44.7",403,Luxembourg,Blind SQLi,9,1,22,FP,West rise pressure somebody off.,13,6,0.0,0.0,0.0,1.0,0.0,1.0,0.0
ALERT_840,96.136.30.208,http://www.dean.net/,Most dark glass.,Mozilla/5.0 (compatible; MSIE 5.0; Windows CE; Trident/3.1),500,Pakistan,Blind SQLi,1,1,50,FP,,14,6,0.0,0.0,0.0,1.0,0.0,0.0,1.0
ALERT_841,81.16.102.57,http://lucas.com/,Discuss structure attention.,Mozilla/5.0 (Macintosh; PPC Mac OS X 10_8_2; rv:1.9.2.20) Gecko/6832-06-02 20:30:15 Firefox/3.6.12,403,Ukraine,Stored XSS,4,4,40,FP,,14,6,0.0,0.0,0.0,1.0,0.0,1.0,0.0
ALERT_842,33.74.160.71,http://brown.com/,Direction price ago sure we citizen approach.,"Mozilla/5.0 (iPod; U; CPU iPhone OS 4_1 like Mac OS X; ne-NP) AppleWebKit/531.36.7 (KHTML, like Gecko) Version/3.0.5 Mobile/8B119 Safari/6531.36.7",200,Monaco,Stored XSS,4,4,11,FP,,14,6,1.0,0.0,0.0,0.0,0.0,1.0,0.0
ALERT_843,76.162.83.126,https://friedman.com/,Never I democratic million sound.,"Mozilla/5.0 (iPod; U; CPU iPhone OS 4_3 like Mac OS X; sid-ET) AppleWebKit/533.30.7 (KHTML, like Gecko) Version/3.0.5 Mobile/8B118 Safari/6533.30.7",500,Lithuania,Stored XSS,7,4,12,FP,,14,6,0.0,0.0,1.0,0.0,1.0,0.0,0.0
ALERT_844,191.253.2.248,https://www.terry.com/,Team our not form billion factor change.,Mozilla/5.0 (compatible; MSIE 7.0; Windows CE; Trident/4.1),404,Equatorial Guinea,Stored XSS,6,4,29,FP,Successful develop woman glass.,14,6,1.0,0.0,0.0,0.0,0.0,1.0,0.0
ALERT_845,27.120.0.168,http://moreno.com/,House marriage knowledge network little camera.,Mozilla/5.0 (compatible; MSIE 5.0; Windows NT 5.0; Trident/3.1),404,Uruguay,Stored XSS,7,2,4,FP,Government sure minute door.,14,6,0.0,0.0,1.0,0.0,0.0,1.0,0.0
ALERT_846,210.24.184.159,http://www.harrison.net/,Along against if catch share cut current.,"Mozilla/5.0 (iPod; U; CPU iPhone OS 3_1 like Mac OS X; raj-IN) AppleWebKit/532.38.7 (KHTML, like Gecko) Version/4.0.5 Mobile/8B112 Safari/6532.38.7",500,Tokelau,Stored XSS,1,2,51,FP,,14,6,0.0,0.0,0.0,1.0,0.0,1.0,0.0
ALERT_847,2.68.118.193,http://www.watson.org/,Effect former heart against thus small attack.,Mozilla/5.0 (X11; Linux x86_64; rv:1.9.5.20) Gecko/7971-03-22 19:40:58 Firefox/3.6.13,404,Uganda,Blind SQLi,6,3,35,TP,,14,6,0.0,0.0,0.0,1.0,1.0,0.0,0.0
ALERT_848,22.221.197.49,http://garcia-adkins.com/,Role dog become truth. System rule scientist.,"Mozilla/5.0 (Windows; U; Windows NT 10.0) AppleWebKit/535.22.6 (KHTML, like Gecko) Version/5.1 Safari/535.22.6",404,Eritrea,Blind SQLi,9,1,30,FP,Water charge place success base.,14,6,1.0,0.0,0.0,0.0,1.0,0.0,0.0
ALERT_849,95.166.173.202,https://www.pace-barrera.com/,Hit else how current.,Mozilla/5.0 (Windows NT 6.0; tl-PH; rv:1.9.0.20) Gecko/9700-05-04 11:51:01 Firefox/3.6.17,200,Saudi Arabia,Stored XSS,3,2,17,FP,,14,6,0.0,1.0,0.0,0.0,0.0,0.0,1.0
ALERT_850,32.54.166.249,https://www.kelly.com/,Own pattern help without mean expect gun first.,Opera/8.70.(Windows NT 6.1; sd-PK) Presto/2.9.183 Version/10.00,403,Pakistan,Stored XSS,6,4,29,FP,Court sing hold necessary western.,14,6,1.0,0.0,0.0,0.0,0.0,1.0,0.0
ALERT_851,111.165.84.191,http://lucas.com/,Would occur participant poor case assume.,"Mozilla/5.0 (X11; Linux x86_64) AppleWebKit/533.0 (KHTML, like Gecko) Chrome/32.0.831.0 Safari/533.0",200,Slovakia (Slovak Republic),Blind SQLi,1,3,51,FP,Bring manage person appear hear benefit deep.,14,6,0.0,0.0,0.0,1.0,0.0,1.0,0.0
ALERT_852,27.207.103.191,http://www.white.com/,Service decade view seem mouth voice many.,"Mozilla/5.0 (X11; Linux i686) AppleWebKit/533.1 (KHTML, like Gecko) Chrome/60.0.893.0 Safari/533.1",403,Brunei Darussalam,Blind SQLi,9,2,8,TP,,14,6,1.0,0.0,0.0,0.0,0.0,1.0,0.0
ALERT_853,44.15.98.187,https://henderson.com/,Daughter build choice card act rest very case.,Mozilla/5.0 (Android 4.4; Mobile; rv:63.0) Gecko/63.0 Firefox/63.0,404,Cayman Islands,Stored XSS,7,1,51,FP,,14,6,0.0,1.0,0.0,0.0,0.0,1.0,0.0
ALERT_854,222.50.217.153,https://www.burch.com/,Gas might appear prepare tax high.,"Mozilla/5.0 (Linux; Android 7.1) AppleWebKit/533.2 (KHTML, like Gecko) Chrome/53.0.810.0 Safari/533.2",403,Kiribati,Stored XSS,4,2,56,TP,,14,6,1.0,0.0,0.0,0.0,0.0,0.0,1.0
ALERT_855,47.127.232.243,https://www.villanueva-estrada.biz/,Relationship outside fall have popular.,Opera/9.46.(X11; Linux i686; lzh-TW) Presto/2.9.185 Version/11.00,200,Liberia,Blind SQLi,1,2,35,FP,Word matter group his improve who evening.,14,6,0.0,1.0,0.0,0.0,0.0,0.0,1.0
ALERT_856,44.87.134.198,http://www.butler.biz/,Focus individual indicate buy one.,"Mozilla/5.0 (Windows; U; Windows 98; Win 9x 4.90) AppleWebKit/534.2.3 (KHTML, like Gecko) Version/5.0.2 Safari/534.2.3",500,Brunei Darussalam,Stored XSS,5,4,59,TP,Care sister head seem Republican miss.,14,6,0.0,1.0,0.0,0.0,1.0,0.0,0.0
ALERT_857,166.183.149.94,https://burton.com/,Thing require total about second author fine.,Opera/9.57.(X11; Linux x86_64; ia-FR) Presto/2.9.175 Version/11.00,200,Malta,Blind SQLi,6,1,24,FP,Make economy their boy.,14,6,0.0,0.0,1.0,0.0,0.0,0.0,1.0
ALERT_858,58.91.226.215,http://miller-hernandez.com/,Meet anything then season hear out choice.,Mozilla/5.0 (Windows 98; Win 9x 4.90; bg-BG; rv:1.9.1.20) Gecko/8596-10-08 07:36:41 Firefox/3.8,500,Jordan,Blind SQLi,9,4,58,TP,Study message individual include cup can artist.,14,6,0.0,1.0,0.0,0.0,0.0,0.0,1.0
ALERT_859,82.105.9.53,http://www.randall-gonzalez.net/,Service effect drug cup cost.,Mozilla/5.0 (Windows NT 6.2; ckb-IQ; rv:1.9.1.20) Gecko/9108-01-19 06:23:02 Firefox/8.0,500,Christmas Island,Blind SQLi,4,1,20,FP,,14,6,1.0,0.0,0.0,0.0,0.0,0.0,1.0
ALERT_860,208.167.227.35,https://browning-porter.com/,Generation here than spring.,"Mozilla/5.0 (Macintosh; PPC Mac OS X 10_7_5 rv:3.0; ko-KR) AppleWebKit/534.14.7 (KHTML, like Gecko) Version/4.0.3 Safari/534.14.7",404,Chad,Stored XSS,4,2,31,TP,Require trade dinner performance call.,14,6,0.0,1.0,0.0,0.0,0.0,1.0,0.0
ALERT_861,75.4.49.147,http://bush.com/,However do similar agree blue pattern.,"Mozilla/5.0 (Windows; U; Windows CE) AppleWebKit/532.44.1 (KHTML, like Gecko) Version/5.0.4 Safari/532.44.1",404,Russian Federation,Blind SQLi,8,4,48,TP,Staff black sense born nature ago system camera.,14,6,0.0,0.0,1.0,0.0,1.0,0.0,0.0
ALERT_862,32.58.254.20,https://www.lewis.com/,Interesting difficult subject simple the herself.,"Mozilla/5.0 (iPod; U; CPU iPhone OS 3_0 like Mac OS X; kw-GB) AppleWebKit/533.42.4 (KHTML, like Gecko) Version/3.0.5 Mobile/8B117 Safari/6533.42.4",404,Japan,Stored XSS,4,4,44,FP,,14,6,0.0,0.0,0.0,1.0,0.0,1.0,0.0
ALERT_863,44.93.135.235,https://www.green.com/,Tonight community dark soldier impact.,Mozilla/5.0 (Windows 98; Win 9x 4.90; ayc-PE; rv:1.9.0.20) Gecko/8376-01-04 23:57:36 Firefox/14.0,404,Ireland,Stored XSS,7,4,55,FP,,14,6,0.0,1.0,0.0,0.0,0.0,1.0,0.0
ALERT_864,116.47.142.111,https://briggs.com/,Maybe attorney trial for prepare guy board.,"Mozilla/5.0 (Windows; U; Windows NT 5.0) AppleWebKit/532.33.7 (KHTML, like Gecko) Version/5.0.2 Safari/532.33.7",404,Barbados,Stored XSS,1,4,45,FP,,14,6,0.0,0.0,1.0,0.0,0.0,1.0,0.0
ALERT_865,205.246.83.140,https://www.green.org/,Energy back here pass reality television.,Mozilla/5.0 (X11; Linux x86_64; rv:1.9.6.20) Gecko/3270-09-07 04:06:22 Firefox/3.8,404,Pakistan,Blind SQLi,4,2,3,FP,,14,6,1.0,0.0,0.0,0.0,1.0,0.0,0.0
ALERT_866,81.170.7.98,http://taylor-weaver.org/,Safe yourself home finally.,Opera/9.31.(X11; Linux i686; es-PA) Presto/2.9.182 Version/12.00,200,Pitcairn Islands,Stored XSS,9,2,54,FP,,14,6,0.0,0.0,0.0,1.0,0.0,0.0,1.0
ALERT_867,183.198.208.249,https://russell-norman.org/,Trip smile save cover.,"Mozilla/5.0 (Macintosh; U; Intel Mac OS X 10_11_5) AppleWebKit/533.1 (KHTML, like Gecko) Chrome/54.0.899.0 Safari/533.1",200,Ukraine,Blind SQLi,5,4,59,FP,,14,6,0.0,0.0,0.0,1.0,0.0,0.0,1.0
ALERT_868,104.226.25.7,https://www.hernandez-johnston.com/,Kitchen night writer weight television.,Mozilla/5.0 (compatible; MSIE 7.0; Windows NT 6.0; Trident/5.1),403,Mauritius,Stored XSS,2,4,30,FP,,14,6,0.0,1.0,0.0,0.0,0.0,0.0,1.0
ALERT_869,116.155.203.100,https://www.ellison.info/,Positive good leave middle use yourself full.,Mozilla/5.0 (Windows 95; iw-IL; rv:1.9.0.20) Gecko/3477-10-23 13:52:08 Firefox/3.6.14,200,Cyprus,Stored XSS,2,3,6,FP,Form term cell positive effort after.,14,6,1.0,0.0,0.0,0.0,0.0,0.0,1.0
ALERT_870,95.92.179.217,http://www.horne-smith.org/,Radio chance turn sing down.,Mozilla/5.0 (compatible; MSIE 6.0; Windows NT 6.2; Trident/3.0),200,Solomon Islands,Blind SQLi,8,2,51,FP,,14,6,0.0,0.0,0.0,1.0,1.0,0.0,0.0
ALERT_871,185.82.28.40,http://marks.com/,Trip reduce peace compare want.,Mozilla/5.0 (Windows 98; Win 9x 4.90; cv-RU; rv:1.9.1.20) Gecko/3226-07-10 01:29:40 Firefox/15.0,500,Malawi,Blind SQLi,2,2,58,TP,,14,6,0.0,0.0,1.0,0.0,0.0,0.0,1.0
ALERT_872,46.100.87.96,https://brown.com/,Smile record sister leg lot today science.,Opera/8.19.(X11; Linux i686; nan-TW) Presto/2.9.167 Version/11.00,200,Anguilla,Stored XSS,3,4,20,FP,Impact tree senior true painting structure.,14,6,0.0,0.0,1.0,0.0,0.0,1.0,0.0
ALERT_873,48.183.1.83,http://jones.com/,Far police collection sound same.,"Mozilla/5.0 (iPhone; CPU iPhone OS 17_1 like Mac OS X) AppleWebKit/534.2 (KHTML, like Gecko) FxiOS/16.7i8425.0 Mobile/58C255 Safari/534.2",500,Svalbard & Jan Mayen Islands,Blind SQLi,8,3,39,TP,Challenge read tax region.,14,6,0.0,1.0,0.0,0.0,0.0,0.0,1.0
ALERT_874,101.107.4.125,http://www.lyons.com/,Try idea push serve charge other.,"Mozilla/5.0 (Windows; U; Windows CE) AppleWebKit/534.11.6 (KHTML, like Gecko) Version/4.0.5 Safari/534.11.6",404,Turkmenistan,Stored XSS,3,2,28,TP,Range dinner last service stock.,14,6,0.0,0.0,0.0,1.0,0.0,0.0,1.0
ALERT_875,62.97.137.199,https://www.foster.com/,Difference relationship safe cup science nice.,Opera/8.13.(Windows NT 5.0; nan-TW) Presto/2.9.165 Version/10.00,403,Western Sahara,Blind SQLi,8,2,21,FP,Eye their laugh against.,14,6,1.0,0.0,0.0,0.0,1.0,0.0,0.0
