ALERT_485,44.149.143.104,http://nelson.com/,Learn interview those class some.,Opera/8.98.(Windows NT 4.0; sid-ET) Presto/2.9.182 Version/11.00,200,Vanuatu,Blind SQLi,8,3,15,TP,Person herself result drug.,8,6,0.0,0.0,1.0,0.0,0.0,1.0,0.0
ALERT_486,78.82.75.118,https://www.washington.com/,Middle reduce month minute of member.,"Mozilla/5.0 (Macintosh; U; PPC Mac OS X 10_8_3 rv:2.0; kn-IN) AppleWebKit/532.26.2 (KHTML, like Gecko) Version/4.0.4 Safari/532.26.2",404,South Georgia and the South Sandwich Islands,Stored XSS,3,3,49,TP,Employee yourself early growth eat short these.,8,6,0.0,0.0,1.0,0.0,1.0,0.0,0.0
ALERT_487,223.55.99.249,http://lee-tran.com/,Detail line pattern memory similar bit.,Mozilla/5.0 (compatible; MSIE 9.0; Windows NT 6.2; Trident/3.1),404,Pitcairn Islands,Stored XSS,2,4,1,FP,,8,6,0.0,0.0,0.0,1.0,0.0,0.0,1.0
ALERT_488,99.47.143.128,https://www.richardson.biz/,Accept election throw involve.,"Mozilla/5.0 (Linux; Android 2.3) AppleWebKit/535.2 (KHTML, like Gecko) Chrome/41.0.872.0 Safari/535.2",500,Antigua and Barbuda,Blind SQLi,1,3,47,FP,Show simple network share figure suddenly Mrs tell.,8,6,0.0,0.0,1.0,0.0,0.0,0.0,1.0
ALERT_489,182.7.42.136,http://www.phillips.info/,Business full risk young fire measure page.,Mozilla/5.0 (Windows NT 5.0; shs-CA; rv:1.9.1.20) Gecko/2969-07-28 09:23:43 Firefox/3.6.4,500,Korea,Blind SQLi,6,4,29,FP,Form develop Congress policy.,8,6,0.0,0.0,1.0,0.0,1.0,0.0,0.0
ALERT_490,215.55.186.23,https://washington.com/,Recent coach dog suddenly that who.,Mozilla/5.0 (compatible; MSIE 5.0; Windows NT 5.0; Trident/3.1),403,Honduras,Stored XSS,3,2,3,FP,Dinner whose discussion main reason.,8,6,0.0,1.0,0.0,0.0,0.0,1.0,0.0
ALERT_491,118.54.60.172,https://www.delacruz.info/,Have our buy entire democratic.,Mozilla/5.0 (Windows NT 6.1; km-KH; rv:1.9.1.20) Gecko/3769-07-02 18:12:41 Firefox/3.6.20,404,South Georgia and the South Sandwich Islands,Stored XSS,3,4,27,FP,Industry art happen church direction drop.,8,6,0.0,0.0,0.0,1.0,0.0,0.0,1.0
ALERT_492,157.81.2.215,http://www.whitaker.biz/,Same wrong couple what. At ability level.,Opera/8.11.(X11; Linux i686; tn-ZA) Presto/2.9.162 Version/12.00,404,Singapore,Stored XSS,5,4,23,FP,,8,6,1.0,0.0,0.0,0.0,0.0,1.0,0.0
ALERT_493,137.207.124.218,http://www.young-holloway.com/,Pull raise wife relationship. Run miss agree.,Mozilla/5.0 (compatible; MSIE 7.0; Windows NT 5.2; Trident/4.0),200,Norfolk Island,Blind SQLi,1,3,41,FP,Agree skin interview indicate add.,8,6,0.0,0.0,0.0,1.0,1.0,0.0,0.0
ALERT_494,105.241.245.123,http://www.orr-thomas.com/,With company important hour around.,Mozilla/5.0 (Android 12; Mobile; rv:32.0) Gecko/32.0 Firefox/32.0,500,Algeria,Stored XSS,4,4,22,FP,Glass red evidence score wait process.,8,6,0.0,0.0,1.0,0.0,0.0,0.0,1.0
ALERT_495,26.82.38.3,http://montoya-bennett.biz/,Middle low research success both.,Mozilla/5.0 (X11; Linux i686; rv:1.9.7.20) Gecko/2081-11-07 13:01:59 Firefox/3.8,403,Mongolia,Blind SQLi,8,4,16,TP,,8,6,1.0,0.0,0.0,0.0,1.0,0.0,0.0
ALERT_496,163.82.160.49,http://wheeler.com/,Thank hour piece store network live wish meeting.,Opera/8.13.(X11; Linux i686; tcy-IN) Presto/2.9.164 Version/11.00,500,Wallis and Futuna,Blind SQLi,1,3,26,FP,Believe produce significant pass break tell husband increase.,8,6,0.0,0.0,1.0,0.0,0.0,0.0,1.0
ALERT_497,11.163.126.189,https://reynolds.com/,Operation off civil course follow book.,"Mozilla/5.0 (iPad; CPU iPad OS 13_5_1 like Mac OS X) AppleWebKit/531.2 (KHTML, like Gecko) CriOS/35.0.809.0 Mobile/56I902 Safari/531.2",404,Latvia,Blind SQLi,4,2,34,TP,,8,6,0.0,0.0,1.0,0.0,0.0,1.0,0.0
ALERT_498,149.186.246.192,https://www.simmons.net/,Air people next both. Citizen maybe civil.,"Mozilla/5.0 (Macintosh; Intel Mac OS X 10_9_5 rv:2.0; cmn-TW) AppleWebKit/531.17.4 (KHTML, like Gecko) Version/4.1 Safari/531.17.4",500,Central African Republic,Stored XSS,9,4,24,FP,,8,6,0.0,1.0,0.0,0.0,0.0,0.0,1.0
ALERT_499,30.146.195.195,https://howard.info/,Simply seem kitchen shake hope hotel.,Mozilla/5.0 (Macintosh; U; Intel Mac OS X 10_7_0; rv:1.9.5.20) Gecko/4960-05-06 12:28:16 Firefox/3.6.13,500,Marshall Islands,Stored XSS,1,4,4,TP,,8,6,0.0,0.0,1.0,0.0,0.0,0.0,1.0
ALERT_500,43.30.160.31,http://www.harris-fowler.biz/,Building drive bank special sure deal.,"Mozilla/5.0 (Windows; U; Windows NT 5.2) AppleWebKit/532.10.7 (KHTML, like Gecko) Version/4.0.2 Safari/532.10.7",404,Tajikistan,Stored XSS,6,1,6,TP,Cause decision chance area discussion stage involve.,8,6,0.0,0.0,1.0,0.0,0.0,0.0,1.0
ALERT_501,220.10.68.23,http://huynh-anderson.com/,Continue election arrive agency.,Opera/8.37.(Windows NT 6.1; mag-IN) Presto/2.9.160 Version/10.00,500,Kenya,Blind SQLi,2,3,13,TP,Believe event fund until myself your.,8,6,0.0,1.0,0.0,0.0,0.0,0.0,1.0
ALERT_502,53.120.227.81,https://watson-hall.com/,Nothing store mission maybe perform make.,Opera/9.56.(Windows NT 4.0; hi-IN) Presto/2.9.175 Version/11.00,500,Bulgaria,Blind SQLi,3,2,36,FP,,8,6,0.0,0.0,1.0,0.0,0.0,1.0,0.0
ALERT_503,123.131.128.57,https://blackburn.biz/,Within chance area safe state.,Mozilla/5.0 (compatible; MSIE 6.0; Windows NT 6.2; Trident/5.0),200,Mauritania,Blind SQLi,6,3,6,TP,,8,6,0.0,1.0,0.0,0.0,0.0,0.0,1.0
ALERT_504,201.120.245.146,http://www.bryant-kemp.net/,North example dark against.,Mozilla/5.0 (compatible; MSIE 7.0; Windows NT 6.0; Trident/5.1),403,Vanuatu,Stored XSS,4,4,2,FP,,8,6,0.0,1.0,0.0,0.0,0.0,1.0,0.0
ALERT_505,118.101.164.63,http://www.mcintosh-alexander.net/,Must hour nice answer body.,Mozilla/5.0 (compatible; MSIE 6.0; Windows NT 5.01; Trident/5.0),200,Rwanda,Blind SQLi,2,4,42,FP,,8,6,0.0,0.0,0.0,1.0,1.0,0.0,0.0
ALERT_506,198.172.227.187,http://bradley.com/,Suggest few decide player nor.,Mozilla/5.0 (Macintosh; U; PPC Mac OS X 10_5_7; rv:1.9.5.20) Gecko/5338-07-17 00:40:24 Firefox/3.6.9,200,Ecuador,Stored XSS,7,3,14,FP,Size way officer nearly.,8,6,0.0,0.0,0.0,1.0,1.0,0.0,0.0
ALERT_507,33.9.201.154,http://www.castillo-nolan.com/,Republican at health yeah almost ahead.,Mozilla/5.0 (compatible; MSIE 5.0; Windows NT 5.0; Trident/3.1),404,Ireland,Blind SQLi,9,3,44,FP,,8,6,0.0,0.0,0.0,1.0,0.0,0.0,1.0
ALERT_508,66.0.25.130,https://wood.com/,Memory happen bed.,"Mozilla/5.0 (iPod; U; CPU iPhone OS 3_1 like Mac OS X; tcy-IN) AppleWebKit/531.30.1 (KHTML, like Gecko) Version/4.0.5 Mobile/8B112 Safari/6531.30.1",404,Cayman Islands,Blind SQLi,4,2,11,FP,,8,6,1.0,0.0,0.0,0.0,0.0,0.0,1.0
ALERT_509,145.61.177.172,https://barker.com/,Return soon school son.,"Mozilla/5.0 (iPod; U; CPU iPhone OS 3_3 like Mac OS X; rw-RW) AppleWebKit/535.9.6 (KHTML, like Gecko) Version/4.0.5 Mobile/8B114 Safari/6535.9.6",403,Latvia,Stored XSS,1,4,22,TP,,8,6,0.0,0.0,0.0,1.0,0.0,0.0,1.0
ALERT_510,30.164.6.9,https://miller.com/,Opportunity board political image.,Mozilla/5.0 (compatible; MSIE 7.0; Windows NT 6.0; Trident/4.0),500,Aruba,Stored XSS,3,1,39,FP,,8,6,1.0,0.0,0.0,0.0,0.0,1.0,0.0
ALERT_511,35.240.47.188,http://thompson.com/,Artist determine federal training certain than.,"Mozilla/5.0 (Macintosh; Intel Mac OS X 10_5_3 rv:4.0; raj-IN) AppleWebKit/533.42.3 (KHTML, like Gecko) Version/5.1 Safari/533.42.3",403,Turkey,Blind SQLi,1,1,57,FP,,8,6,0.0,1.0,0.0,0.0,1.0,0.0,0.0
ALERT_512,52.52.90.146,https://knapp.biz/,Book media full where might institution.,Mozilla/5.0 (compatible; MSIE 9.0; Windows NT 5.1; Trident/4.0),403,New Zealand,Blind SQLi,1,3,9,FP,,8,6,0.0,1.0,0.0,0.0,0.0,1.0,0.0
ALERT_513,79.32.95.167,https://atkins.info/,Check which force president create.,Mozilla/5.0 (Windows 98; Win 9x 4.90; bhb-IN; rv:1.9.1.20) Gecko/7852-05-05 18:19:29 Firefox/3.6.11,500,Samoa,Stored XSS,6,2,43,FP,Show fire outside spring from today him.,8,6,0.0,1.0,0.0,0.0,0.0,0.0,1.0
ALERT_514,192.8.47.197,http://www.jenkins.org/,Call safe eight. Director fly our admit phone.,"Mozilla/5.0 (iPhone; CPU iPhone OS 4_2_1 like Mac OS X) AppleWebKit/533.0 (KHTML, like Gecko) FxiOS/13.3w0274.0 Mobile/52T306 Safari/533.0",200,Chad,Blind SQLi,3,3,16,FP,Compare should evidence through.,8,6,1.0,0.0,0.0,0.0,1.0,0.0,0.0
ALERT_515,207.244.238.254,http://green-huffman.com/,Republican fine bill modern blood ask.,"Mozilla/5.0 (Windows NT 6.2) AppleWebKit/532.0 (KHTML, like Gecko) Chrome/60.0.849.0 Safari/532.0",500,Turkmenistan,Stored XSS,5,3,52,FP,Number follow right instead worker.,8,6,0.0,1.0,0.0,0.0,0.0,0.0,1.0
ALERT_516,52.66.94.33,http://www.wolf-williams.com/,Add benefit speech floor plan vote.,"Mozilla/5.0 (iPad; CPU iPad OS 14_2 like Mac OS X) AppleWebKit/531.2 (KHTML, like Gecko) FxiOS/12.9a9602.0 Mobile/38E352 Safari/531.2",404,Marshall Islands,Stored XSS,3,2,31,FP,,8,6,0.0,1.0,0.0,0.0,0.0,1.0,0.0
ALERT_517,107.90.38.152,https://taylor-guzman.org/,Spring billion never large throw party most.,"Mozilla/5.0 (iPod; U; CPU iPhone OS 3_0 like Mac OS X; km-KH) AppleWebKit/532.18.7 (KHTML, like Gecko) Version/3.0.5 Mobile/8B117 Safari/6532.18.7",200,Venezuela,Blind SQLi,9,2,44,FP,Hard carry garden form speech.,8,6,1.0,0.0,0.0,0.0,0.0,0.0,1.0
ALERT_518,185.113.39.191,http://www.winters.biz/,Ground bed throw she especially fine skill.,Opera/8.87.(X11; Linux x86_64; ka-GE) Presto/2.9.169 Version/10.00,200,South Africa,Stored XSS,4,3,45,FP,,8,6,0.0,0.0,0.0,1.0,1.0,0.0,0.0
ALERT_519,108.234.7.117,https://www.hart.com/,Music investment stand quality wrong happen.,"Mozilla/5.0 (iPod; U; CPU iPhone OS 4_1 like Mac OS X; ik-CA) AppleWebKit/531.6.5 (KHTML, like Gecko) Version/3.0.5 Mobile/8B113 Safari/6531.6.5",200,Honduras,Blind SQLi,6,3,10,FP,,8,6,0.0,0.0,0.0,1.0,0.0,1.0,0.0
ALERT_520,196.253.11.56,http://vega.com/,In sell such there wait successful.,Opera/9.27.(X11; Linux x86_64; iu-CA) Presto/2.9.167 Version/12.00,403,Isle of Man,Stored XSS,3,1,29,FP,,8,6,0.0,0.0,1.0,0.0,0.0,0.0,1.0
ALERT_521,33.203.106.153,http://www.johnson-estrada.com/,Police it cultural analysis add write source.,Mozilla/5.0 (X11; Linux x86_64; rv:1.9.7.20) Gecko/8129-11-25 12:31:55 Firefox/3.8,500,Kazakhstan,Stored XSS,9,4,45,FP,,8,6,0.0,1.0,0.0,0.0,0.0,0.0,1.0
ALERT_522,62.117.246.217,https://olson.com/,Medical challenge check.,Opera/9.34.(Windows 98; Win 9x 4.90; om-ET) Presto/2.9.183 Version/10.00,403,Gambia,Blind SQLi,6,3,45,TP,Suggest time soldier treat allow this light.,8,6,0.0,1.0,0.0,0.0,0.0,1.0,0.0
ALERT_523,153.142.22.209,https://price-haynes.biz/,You artist animal be remember need.,Opera/8.29.(X11; Linux i686; gv-GB) Presto/2.9.173 Version/11.00,500,Saint Martin,Blind SQLi,8,1,41,FP,Chair remain fact interview us general if.,8,6,0.0,0.0,1.0,0.0,0.0,1.0,0.0
ALERT_524,180.7.241.249,http://www.walker.info/,Growth including very.,Opera/8.73.(Windows 98; Win 9x 4.90; ak-GH) Presto/2.9.171 Version/11.00,403,Switzerland,Blind SQLi,4,1,33,FP,Model between hit.,8,6,0.0,1.0,0.0,0.0,0.0,0.0,1.0
ALERT_525,24.131.147.234,http://www.ward.com/,Toward cut cultural.,Opera/9.17.(X11; Linux i686; sk-SK) Presto/2.9.161 Version/10.00,404,Guernsey,Stored XSS,1,1,28,FP,Force main watch and.,8,6,0.0,1.0,0.0,0.0,0.0,1.0,0.0
ALERT_526,195.103.255.154,https://www.hughes-cortez.biz/,Travel health space wear total future laugh.,Opera/8.31.(X11; Linux x86_64; ku-TR) Presto/2.9.165 Version/12.00,500,Brazil,Stored XSS,1,1,2,FP,,8,6,0.0,1.0,0.0,0.0,0.0,0.0,1.0
ALERT_527,100.51.39.219,https://mcdaniel-jones.com/,Couple throw skin stage culture woman like son.,"Mozilla/5.0 (iPod; U; CPU iPhone OS 4_1 like Mac OS X; oc-FR) AppleWebKit/533.8.6 (KHTML, like Gecko) Version/3.0.5 Mobile/8B111 Safari/6533.8.6",403,Belize,Blind SQLi,2,4,27,TP,,8,6,1.0,0.0,0.0,0.0,0.0,1.0,0.0
ALERT_528,192.189.112.244,https://hansen.com/,Thing deep education rich.,"Mozilla/5.0 (iPod; U; CPU iPhone OS 4_0 like Mac OS X; unm-US) AppleWebKit/533.14.1 (KHTML, like Gecko) Version/4.0.5 Mobile/8B118 Safari/6533.14.1",404,Tokelau,Stored XSS,1,4,21,FP,,8,6,0.0,1.0,0.0,0.0,0.0,0.0,1.0
ALERT_529,47.108.16.27,https://www.shepherd-thompson.com/,Music act say. On card else still water.,Mozilla/5.0 (compatible; MSIE 5.0; Windows 98; Win 9x 4.90; Trident/3.1),403,Cayman Islands,Blind SQLi,3,1,51,FP,Foot cell thousand player very world hair.,8,6,0.0,1.0,0.0,0.0,0.0,1.0,0.0
ALERT_530,98.148.78.7,https://robinson.com/,Seat shake plant too. Full teach free design.,"Mozilla/5.0 (iPod; U; CPU iPhone OS 3_0 like Mac OS X; aa-ER) AppleWebKit/532.15.4 (KHTML, like Gecko) Version/3.0.5 Mobile/8B118 Safari/6532.15.4",500,Sri Lanka,Stored XSS,7,1,40,FP,,8,6,0.0,0.0,0.0,1.0,0.0,1.0,0.0
ALERT_531,171.42.132.56,http://www.payne-gonzalez.com/,Machine others suffer debate stage each.,Mozilla/5.0 (compatible; MSIE 9.0; Windows NT 6.1; Trident/5.0),200,Nauru,Stored XSS,7,4,12,FP,,8,6,0.0,0.0,1.0,0.0,0.0,1.0,0.0
ALERT_532,146.72.152.84,https://www.wilson.info/,Suffer charge past agency.,"Mozilla/5.0 (Macintosh; PPC Mac OS X 10_8_3) AppleWebKit/534.2 (KHTML, like Gecko) Chrome/14.0.894.0 Safari/534.2",404,Iraq,Stored XSS,2,4,37,FP,Car join second for now.,8,6,0.0,0.0,0.0,1.0,0.0,0.0,1.0
ALERT_533,115.14.104.124,https://www.hood.com/,Keep analysis culture side fire at.,"Mozilla/5.0 (Linux; Android 5.0) AppleWebKit/536.2 (KHTML, like Gecko) Chrome/31.0.863.0 Safari/536.2",200,Palau,Blind SQLi,9,4,59,FP,,8,6,0.0,0.0,1.0,0.0,0.0,0.0,1.0
ALERT_534,36.6.96.215,https://bates.com/,Radio style far down where better sometimes.,"Mozilla/5.0 (Windows; U; Windows 98; Win 9x 4.90) AppleWebKit/535.42.6 (KHTML, like Gecko) Version/4.0 Safari/535.42.6",404,Niue,Blind SQLi,9,2,54,FP,Economy bad citizen.,8,6,0.0,0.0,1.0,0.0,0.0,0.0,1.0
ALERT_535,60.123.111.130,http://fuller.org/,Wait lead either born drop fast home.,Opera/8.83.(X11; Linux x86_64; nds-NL) Presto/2.9.177 Version/11.00,200,Norway,Stored XSS,5,2,4,FP,Role pay like like add so.,8,6,0.0,0.0,1.0,0.0,0.0,0.0,1.0
ALERT_536,81.35.115.90,http://ward-saunders.com/,Must father teacher or reveal seek difficult.,Opera/9.26.(Windows 98; Win 9x 4.90; tig-ER) Presto/2.9.170 Version/10.00,404,Aruba,Blind SQLi,2,2,14,TP,Person school everyone upon ever board nearly middle.,8,6,1.0,0.0,0.0,0.0,0.0,0.0,1.0
ALERT_537,67.128.104.52,http://perez.com/,Leg money low task financial try body.,Opera/9.96.(X11; Linux i686; ks-IN) Presto/2.9.188 Version/11.00,404,Maldives,Stored XSS,8,2,20,TP,,8,6,0.0,0.0,1.0,0.0,1.0,0.0,0.0
ALERT_538,139.102.92.242,http://www.owen.com/,Tonight finally part subject.,"Mozilla/5.0 (Windows; U; Windows CE) AppleWebKit/533.33.6 (KHTML, like Gecko) Version/4.0.4 Safari/533.33.6",200,Belarus,Stored XSS,2,3,5,TP,,8,6,0.0,1.0,0.0,0.0,0.0,0.0,1.0
ALERT_539,116.251.123.36,http://www.johnson.net/,Read save than available music low the hour.,"Mozilla/5.0 (Windows; U; Windows NT 5.01) AppleWebKit/533.24.1 (KHTML, like Gecko) Version/4.0.2 Safari/533.24.1",200,Korea,Stored XSS,3,4,13,FP,East state focus notice.,8,6,0.0,0.0,0.0,1.0,0.0,0.0,1.0
ALERT_540,78.35.141.234,http://henry.com/,Anything ok her minute. Old common begin.,Mozilla/5.0 (compatible; MSIE 9.0; Windows NT 5.2; Trident/4.0),500,Jordan,Stored XSS,9,3,19,FP,,9,6,1.0,0.0,0.0,0.0,0.0,0.0,1.0
ALERT_541,175.147.153.133,https://salazar.info/,Anyone company before. If I picture television.,"Mozilla/5.0 (Windows; U; Windows NT 10.0) AppleWebKit/534.45.4 (KHTML, like Gecko) Version/5.0.3 Safari/534.45.4",200,Zimbabwe,Blind SQLi,7,1,30,FP,Magazine each just structure page voice scene street.,9,6,1.0,0.0,0.0,0.0,0.0,1.0,0.0
ALERT_542,223.16.188.164,https://www.sandoval-cox.com/,Whether pressure describe.,Mozilla/5.0 (compatible; MSIE 7.0; Windows NT 5.0; Trident/4.1),500,Malta,Blind SQLi,3,4,23,TP,Begin stand government present finish unit board.,9,6,0.0,1.0,0.0,0.0,1.0,0.0,0.0
ALERT_543,65.25.75.79,http://jones-barrera.com/,The response well.,"Mozilla/5.0 (Windows 95) AppleWebKit/532.1 (KHTML, like Gecko) Chrome/21.0.870.0 Safari/532.1",200,Isle of Man,Stored XSS,2,1,13,FP,,9,6,1.0,0.0,0.0,0.0,0.0,0.0,1.0
ALERT_544,146.167.32.0,https://www.morales.com/,Together audience again gun color avoid several.,Mozilla/5.0 (Windows NT 5.0; gl-ES; rv:1.9.2.20) Gecko/3177-05-11 21:09:31 Firefox/3.8,404,Rwanda,Stored XSS,9,2,31,FP,,9,6,0.0,0.0,0.0,1.0,0.0,0.0,1.0
ALERT_545,47.55.133.80,https://www.martinez-carpenter.net/,Live guess order specific police course.,Opera/8.83.(X11; Linux i686; dv-MV) Presto/2.9.172 Version/11.00,404,Sierra Leone,Blind SQLi,3,4,32,FP,,9,6,1.0,0.0,0.0,0.0,0.0,1.0,0.0
ALERT_546,7.202.192.182,https://www.cruz-walker.com/,Large such place former later result.,Opera/8.55.(X11; Linux x86_64; ml-IN) Presto/2.9.185 Version/11.00,404,Brazil,Stored XSS,8,3,45,FP,,9,6,1.0,0.0,0.0,0.0,0.0,0.0,1.0
ALERT_547,102.83.20.182,http://davis.com/,Shoulder language western professional plan out.,"Mozilla/5.0 (iPod; U; CPU iPhone OS 4_3 like Mac OS X; ss-ZA) AppleWebKit/535.48.6 (KHTML, like Gecko) Version/4.0.5 Mobile/8B113 Safari/6535.48.6",500,Guatemala,Stored XSS,4,1,9,FP,,9,6,0.0,0.0,0.0,1.0,1.0,0.0,0.0
ALERT_548,143.99.178.58,http://www.shields.org/,War meeting somebody end watch.,Mozilla/5.0 (compatible; MSIE 7.0; Windows NT 6.0; Trident/5.1),500,Dominica,Blind SQLi,4,2,16,FP,,9,6,0.0,0.0,0.0,1.0,0.0,0.0,1.0
ALERT_549,39.138.90.99,https://www.higgins-west.org/,Fire consider pattern. Year man store nation.,"Mozilla/5.0 (iPad; CPU iPad OS 17_1_1 like Mac OS X) AppleWebKit/533.2 (KHTML, like Gecko) FxiOS/18.6r1970.0 Mobile/70I526 Safari/533.2",500,Namibia,Blind SQLi,8,1,30,FP,,9,6,1.0,0.0,0.0,0.0,0.0,0.0,1.0
ALERT_550,32.240.122.232,https://www.pittman.biz/,Will exactly little certainly risk.,Opera/9.47.(X11; Linux i686; iu-CA) Presto/2.9.176 Version/11.00,200,Saint Kitts and Nevis,Stored XSS,5,1,47,TP,Deal rich day political case.,9,6,0.0,0.0,1.0,0.0,0.0,1.0,0.0
ALERT_551,180.103.36.216,http://webb.com/,Write each thousand without machine.,"Mozilla/5.0 (iPod; U; CPU iPhone OS 3_3 like Mac OS X; nso-ZA) AppleWebKit/535.43.4 (KHTML, like Gecko) Version/4.0.5 Mobile/8B115 Safari/6535.43.4",403,Gambia,Stored XSS,8,4,55,FP,,9,6,0.0,0.0,0.0,1.0,0.0,0.0,1.0
ALERT_552,171.250.223.197,https://www.carey-andersen.biz/,Now can walk beautiful town.,Mozilla/5.0 (Windows NT 5.2; dz-BT; rv:1.9.1.20) Gecko/9884-11-06 06:37:51 Firefox/3.8,404,Pakistan,Stored XSS,6,2,17,FP,Door nation wear.,9,6,0.0,1.0,0.0,0.0,1.0,0.0,0.0
ALERT_553,35.182.105.134,http://snyder.com/,Hold truth board down.,Opera/8.34.(Windows NT 5.01; en-ZA) Presto/2.9.162 Version/12.00,500,Algeria,Blind SQLi,8,3,17,FP,Continue economic despite arm old writer court.,9,6,0.0,0.0,1.0,0.0,0.0,1.0,0.0
ALERT_554,43.174.199.233,http://young-lucas.com/,Boy sign agreement enter mind right left.,Mozilla/5.0 (Macintosh; U; PPC Mac OS X 10_5_4; rv:1.9.5.20) Gecko/9357-09-14 11:43:24 Firefox/14.0,200,Togo,Blind SQLi,9,2,50,FP,This focus actually water course friend study.,9,6,0.0,1.0,0.0,0.0,0.0,0.0,1.0
ALERT_555,50.60.11.116,http://www.stanley-norris.com/,Threat only subject avoid.,Opera/8.48.(Windows NT 5.0; cy-GB) Presto/2.9.163 Version/10.00,403,Senegal,Blind SQLi,3,1,59,TP,Cold hope brother strong bill.,9,6,0.0,1.0,0.0,0.0,0.0,0.0,1.0
ALERT_556,76.85.199.237,https://www.delacruz.com/,Movement one here picture hot say.,"Mozilla/5.0 (Windows; U; Windows NT 5.01) AppleWebKit/531.24.2 (KHTML, like Gecko) Version/4.0.3 Safari/531.24.2",404,Madagascar,Stored XSS,5,3,15,FP,Thus set door left better teach.,9,6,0.0,0.0,0.0,1.0,1.0,0.0,0.0
ALERT_557,86.64.130.180,https://hill.com/,Rule democratic foot small though.,Mozilla/5.0 (Android 3.0; Mobile; rv:58.0) Gecko/58.0 Firefox/58.0,500,Saint Lucia,Blind SQLi,7,1,55,TP,Final he cause short participant century into.,9,6,0.0,0.0,0.0,1.0,1.0,0.0,0.0
ALERT_558,65.203.200.202,http://www.clark-hernandez.com/,Official condition meet forget.,"Mozilla/5.0 (iPod; U; CPU iPhone OS 4_1 like Mac OS X; zh-SG) AppleWebKit/534.19.3 (KHTML, like Gecko) Version/4.0.5 Mobile/8B112 Safari/6534.19.3",500,Bangladesh,Blind SQLi,5,2,19,FP,,9,6,0.0,1.0,0.0,0.0,1.0,0.0,0.0
ALERT_559,177.122.141.175,https://www.chavez.biz/,Believe by mean can.,Opera/8.79.(Windows NT 6.0; sc-IT) Presto/2.9.160 Version/11.00,404,Panama,Blind SQLi,6,3,36,TP,,9,6,1.0,0.0,0.0,0.0,0.0,0.0,1.0
ALERT_560,89.111.23.59,http://johnson-williams.com/,Form new friend environmental early word study.,Mozilla/5.0 (compatible; MSIE 6.0; Windows NT 10.0; Trident/4.1),500,Saint Helena,Blind SQLi,1,2,40,FP,,9,6,0.0,0.0,0.0,1.0,0.0,0.0,1.0
ALERT_561,85.97.14.154,https://www.lee-murray.com/,Interesting course week brother.,Mozilla/5.0 (compatible; MSIE 7.0; Windows NT 6.2; Trident/5.1),404,Norway,Stored XSS,1,1,22,TP,,9,6,0.0,0.0,1.0,0.0,0.0,0.0,1.0
ALERT_562,213.68.32.203,http://johnson.com/,Model language prevent early reveal.,Mozilla/5.0 (compatible; MSIE 6.0; Windows NT 5.2; Trident/4.0),403,French Southern Territories,Stored XSS,2,3,55,FP,Partner energy recognize else memory.,9,6,1.0,0.0,0.0,0.0,1.0,0.0,0.0
ALERT_563,104.157.149.230,https://www.huynh-white.org/,Need perhaps happy suggest mission sing hope.,"Mozilla/5.0 (X11; Linux x86_64) AppleWebKit/535.0 (KHTML, like Gecko) Chrome/16.0.880.0 Safari/535.0",500,Croatia,Stored XSS,2,4,15,FP,,9,6,0.0,0.0,0.0,1.0,0.0,1.0,0.0
ALERT_564,197.182.231.81,https://davila.info/,Rest life participant run law another quickly.,Mozilla/5.0 (Windows NT 5.1; sl-SI; rv:1.9.0.20) Gecko/6419-04-18 00:21:31 Firefox/3.6.16,500,Fiji,Blind SQLi,5,4,19,FP,Specific likely happy produce subject final.,9,6,0.0,0.0,0.0,1.0,0.0,0.0,1.0
ALERT_565,164.155.125.183,http://www.cortez.com/,Father they none modern.,Mozilla/5.0 (Macintosh; U; Intel Mac OS X 10_9_9; rv:1.9.6.20) Gecko/6908-03-11 23:22:52 Firefox/12.0,500,Guadeloupe,Stored XSS,7,2,13,FP,Black must finally soldier win.,9,6,1.0,0.0,0.0,0.0,1.0,0.0,0.0
ALERT_566,167.114.98.197,https://mercado-matthews.com/,Skin lose laugh name. Art half later.,"Mozilla/5.0 (iPhone; CPU iPhone OS 17_1_2 like Mac OS X) AppleWebKit/533.2 (KHTML, like Gecko) FxiOS/10.2g3155.0 Mobile/10D145 Safari/533.2",404,Nauru,Blind SQLi,9,1,12,FP,,9,6,0.0,0.0,1.0,0.0,0.0,0.0,1.0
ALERT_567,151.125.44.226,http://www.perry-thomas.com/,Goal several short child event.,Mozilla/5.0 (Windows 98; bo-IN; rv:1.9.1.20) Gecko/9708-04-28 23:31:13 Firefox/3.6.19,200,Saint Kitts and Nevis,Blind SQLi,3,2,1,TP,,9,6,1.0,0.0,0.0,0.0,1.0,0.0,0.0
ALERT_568,133.154.62.37,http://www.ferguson.com/,Go station benefit.,Opera/8.20.(Windows NT 5.1; hy-AM) Presto/2.9.185 Version/11.00,403,South Africa,Blind SQLi,2,1,15,FP,,9,6,1.0,0.0,0.0,0.0,0.0,1.0,0.0
ALERT_569,159.177.131.152,https://www.white.com/,Claim even stock number trouble.,"Mozilla/5.0 (iPod; U; CPU iPhone OS 3_1 like Mac OS X; ar-JO) AppleWebKit/534.48.6 (KHTML, like Gecko) Version/3.0.5 Mobile/8B113 Safari/6534.48.6",404,Gambia,Stored XSS,7,4,33,FP,,9,6,0.0,1.0,0.0,0.0,0.0,1.0,0.0
ALERT_570,113.244.49.47,https://www.williams.net/,Need doctor camera hotel suffer so.,Opera/9.72.(Windows NT 5.01; pl-PL) Presto/2.9.176 Version/12.00,403,Antigua and Barbuda,Stored XSS,3,4,30,TP,,9,6,1.0,0.0,0.0,0.0,0.0,0.0,1.0
ALERT_571,182.116.16.208,http://www.gonzales.com/,Guy nothing stop politics cut music.,Mozilla/5.0 (compatible; MSIE 9.0; Windows NT 6.0; Trident/3.0),500,Estonia,Blind SQLi,6,1,1,TP,Major environment reveal avoid detail leader hold her.,9,6,0.0,0.0,0.0,1.0,1.0,0.0,0.0
ALERT_572,217.253.193.109,http://barton.net/,Purpose issue detail public such despite.,Mozilla/5.0 (Macintosh; U; Intel Mac OS X 10_9_3; rv:1.9.5.20) Gecko/2754-11-15 11:40:28 Firefox/3.8,403,South Georgia and the South Sandwich Islands,Stored XSS,5,3,19,FP,New baby rise since.,9,6,1.0,0.0,0.0,0.0,1.0,0.0,0.0
ALERT_573,218.42.67.110,http://martinez.com/,Field task range cold operation scientist.,Opera/9.65.(Windows NT 5.0; quz-PE) Presto/2.9.188 Version/10.00,500,Somalia,Stored XSS,6,1,10,FP,,9,6,0.0,1.0,0.0,0.0,0.0,0.0,1.0
ALERT_574,74.17.192.230,https://irwin-rodriguez.com/,Buy management impact reveal.,Mozilla/5.0 (compatible; MSIE 8.0; Windows NT 4.0; Trident/5.0),403,Bhutan,Stored XSS,5,4,53,FP,,9,6,0.0,0.0,1.0,0.0,0.0,1.0,0.0
ALERT_575,190.254.118.204,http://www.bean.com/,Society long once between.,"Mozilla/5.0 (X11; Linux i686) AppleWebKit/534.0 (KHTML, like Gecko) Chrome/20.0.844.0 Safari/534.0",403,China,Stored XSS,4,1,6,FP,Memory wonder western serve.,9,6,0.0,1.0,0.0,0.0,1.0,0.0,0.0
ALERT_576,150.184.176.197,http://www.williams.com/,Structure answer too return represent also.,Mozilla/5.0 (compatible; MSIE 7.0; Windows NT 5.01; Trident/5.0),500,Niue,Blind SQLi,6,4,31,TP,Foreign responsibility red analysis attorney.,9,6,0.0,0.0,1.0,0.0,0.0,1.0,0.0
ALERT_577,3.147.207.221,http://owens-stone.com/,Since common price success.,"Mozilla/5.0 (X11; Linux i686) AppleWebKit/534.1 (KHTML, like Gecko) Chrome/29.0.885.0 Safari/534.1",404,Guadeloupe,Stored XSS,5,3,5,FP,,9,6,0.0,0.0,1.0,0.0,1.0,0.0,0.0
ALERT_578,9.168.92.115,https://www.carter-webb.biz/,Success bag both treat history.,"Mozilla/5.0 (Windows; U; Windows NT 6.1) AppleWebKit/531.34.2 (KHTML, like Gecko) Version/4.1 Safari/531.34.2",500,Dominica,Blind SQLi,4,2,15,TP,,9,6,0.0,1.0,0.0,0.0,0.0,1.0,0.0
ALERT_579,78.34.57.39,https://www.shaw-ortiz.com/,Her defense billion term. Soldier letter among.,"Mozilla/5.0 (Linux; Android 2.2.3) AppleWebKit/536.0 (KHTML, like Gecko) Chrome/16.0.822.0 Safari/536.0",403,Jordan,Stored XSS,5,3,6,FP,Prove front yeah defense.,9,6,0.0,1.0,0.0,0.0,0.0,0.0,1.0
ALERT_580,120.113.108.129,https://walsh-kelly.com/,Fall put either final.,"Mozilla/5.0 (Macintosh; U; Intel Mac OS X 10_8_5 rv:2.0; ak-GH) AppleWebKit/535.13.2 (KHTML, like Gecko) Version/4.0 Safari/535.13.2",404,French Polynesia,Stored XSS,1,3,43,TP,Figure see line until road.,9,6,0.0,0.0,1.0,0.0,0.0,1.0,0.0
ALERT_581,9.158.31.13,https://www.madden.com/,Real see pretty technology easy measure.,Opera/9.54.(X11; Linux i686; fil-PH) Presto/2.9.186 Version/10.00,403,French Southern Territories,Blind SQLi,6,1,40,TP,Increase sell once mention ahead high.,9,6,0.0,0.0,1.0,0.0,0.0,1.0,0.0
ALERT_582,209.59.206.27,https://hubbard.info/,Bad hard practice kid.,"Mozilla/5.0 (Windows NT 4.0) AppleWebKit/535.2 (KHTML, like Gecko) Chrome/54.0.837.0 Safari/535.2",403,Gibraltar,Blind SQLi,9,3,21,FP,Professor reflect happen mention support three.,9,6,1.0,0.0,0.0,0.0,0.0,0.0,1.0
