ALERT_195,218.70.92.139,https://holder.org/,Thing power medical major option poor.,"Mozilla/5.0 (Windows; U; Windows NT 5.2) AppleWebKit/535.44.2 (KHTML, like Gecko) Version/5.0 Safari/535.44.2",403,Tuvalu,Blind SQLi,3,2,31,TP,Reduce history crime threat whom.,3,6,1.0,0.0,0.0,0.0,0.0,1.0,0.0
ALERT_196,37.158.44.66,http://www.johnson-black.com/,Yeah new themselves put letter drop argue church.,Mozilla/5.0 (Macintosh; PPC Mac OS X 10_6_5; rv:1.9.5.20) Gecko/2038-06-03 12:05:49 Firefox/3.6.16,200,Suriname,Blind SQLi,3,4,47,FP,,3,6,0.0,0.0,1.0,0.0,1.0,0.0,0.0
ALERT_197,188.162.134.124,https://www.foster.com/,Officer probably party claim society outside.,Mozilla/5.0 (compatible; MSIE 7.0; Windows NT 6.0; Trident/4.0),403,Malaysia,Blind SQLi,8,4,18,FP,Edge suggest life answer candidate cup maintain.,3,6,0.0,0.0,1.0,0.0,0.0,1.0,0.0
ALERT_198,87.148.120.223,http://perez.net/,Team while want hair yard until yard.,Mozilla/5.0 (Android 12; Mobile; rv:30.0) Gecko/30.0 Firefox/30.0,200,Moldova,Stored XSS,9,4,14,TP,About light sometimes focus truth television.,3,6,0.0,1.0,0.0,0.0,1.0,0.0,0.0
ALERT_199,145.190.202.69,http://mills.com/,Rest lose inside consider.,"Mozilla/5.0 (iPod; U; CPU iPhone OS 3_0 like Mac OS X; quz-PE) AppleWebKit/533.22.4 (KHTML, like Gecko) Version/4.0.5 Mobile/8B116 Safari/6533.22.4",200,Luxembourg,Stored XSS,8,3,35,TP,Not kind mean include.,3,6,0.0,0.0,1.0,0.0,1.0,0.0,0.0
ALERT_200,154.131.31.198,https://www.hudson.com/,Culture officer character.,"Mozilla/5.0 (Macintosh; PPC Mac OS X 10_7_9) AppleWebKit/533.0 (KHTML, like Gecko) Chrome/42.0.802.0 Safari/533.0",200,Cambodia,Stored XSS,5,2,6,FP,Far north son conference.,3,6,1.0,0.0,0.0,0.0,0.0,0.0,1.0
ALERT_201,165.176.228.60,http://www.torres-sanchez.com/,Reality economic act challenge anyone.,Opera/9.35.(Windows 98; he-IL) Presto/2.9.169 Version/10.00,404,Maldives,Blind SQLi,1,2,40,FP,,3,6,0.0,1.0,0.0,0.0,0.0,1.0,0.0
ALERT_202,159.95.109.248,http://www.payne.com/,Parent ability resource group nothing policy.,Opera/8.35.(X11; Linux x86_64; cv-RU) Presto/2.9.168 Version/12.00,500,Qatar,Blind SQLi,3,3,44,TP,,3,6,0.0,0.0,1.0,0.0,0.0,0.0,1.0
ALERT_203,135.159.50.17,http://long.com/,Away blood lead religious report who beat.,Opera/8.89.(Windows 98; sd-IN) Presto/2.9.183 Version/12.00,404,Latvia,Blind SQLi,2,4,30,FP,Value understand manage quality.,3,6,0.0,0.0,1.0,0.0,1.0,0.0,0.0
ALERT_204,74.150.112.255,http://lopez.com/,Rule enter nearly mind decision phone.,Mozilla/5.0 (compatible; MSIE 5.0; Windows 98; Win 9x 4.90; Trident/3.0),200,Lao People's Democratic Republic,Blind SQLi,6,2,48,FP,Although agree full former.,3,6,0.0,1.0,0.0,0.0,0.0,1.0,0.0
ALERT_205,148.102.4.186,https://www.livingston.com/,About book back brother realize sport over.,"Mozilla/5.0 (Windows NT 5.01) AppleWebKit/534.1 (KHTML, like Gecko) Chrome/28.0.824.0 Safari/534.1",200,Angola,Blind SQLi,1,1,59,TP,Structure speak left how.,3,6,1.0,0.0,0.0,0.0,0.0,1.0,0.0
ALERT_206,103.95.4.54,https://alvarez.biz/,Until summer employee finish.,"Mozilla/5.0 (Windows 98; Win 9x 4.90) AppleWebKit/535.0 (KHTML, like Gecko) Chrome/45.0.809.0 Safari/535.0",404,Jersey,Blind SQLi,1,4,49,FP,,3,6,0.0,1.0,0.0,0.0,0.0,0.0,1.0
ALERT_207,131.10.117.244,https://spencer.com/,Out pick ask hundred.,"Mozilla/5.0 (iPod; U; CPU iPhone OS 3_0 like Mac OS X; hne-IN) AppleWebKit/531.2.4 (KHTML, like Gecko) Version/3.0.5 Mobile/8B119 Safari/6531.2.4",500,Moldova,Blind SQLi,1,1,13,FP,,3,6,1.0,0.0,0.0,0.0,0.0,0.0,1.0
ALERT_208,211.127.112.135,https://www.vazquez-day.com/,Above kind card rich. Discuss stage do hotel.,"Mozilla/5.0 (Macintosh; U; Intel Mac OS X 10_9_3 rv:2.0; bg-BG) AppleWebKit/531.15.1 (KHTML, like Gecko) Version/4.1 Safari/531.15.1",403,Ireland,Blind SQLi,9,3,34,FP,Ready amount you public.,3,6,0.0,0.0,0.0,1.0,0.0,1.0,0.0
ALERT_209,162.165.25.192,https://andersen.info/,Game financial east too pressure eat worker.,"Mozilla/5.0 (iPod; U; CPU iPhone OS 3_0 like Mac OS X; om-ET) AppleWebKit/532.14.6 (KHTML, like Gecko) Version/3.0.5 Mobile/8B112 Safari/6532.14.6",404,Bahamas,Blind SQLi,8,1,27,TP,Try if movie arm brother television this.,3,6,0.0,0.0,0.0,1.0,1.0,0.0,0.0
ALERT_210,124.174.120.145,https://www.brown-goodwin.org/,Chance day training traditional perhaps.,"Mozilla/5.0 (Macintosh; U; Intel Mac OS X 10_6_8) AppleWebKit/533.0 (KHTML, like Gecko) Chrome/27.0.848.0 Safari/533.0",200,Seychelles,Blind SQLi,8,1,18,TP,Actually people unit woman move break.,3,6,1.0,0.0,0.0,0.0,1.0,0.0,0.0
ALERT_211,33.187.18.44,https://www.walsh.com/,Serious law simply and probably in.,"Mozilla/5.0 (iPhone; CPU iPhone OS 9_3_6 like Mac OS X) AppleWebKit/534.1 (KHTML, like Gecko) CriOS/47.0.824.0 Mobile/73G725 Safari/534.1",500,Svalbard & Jan Mayen Islands,Stored XSS,3,2,23,FP,,3,6,1.0,0.0,0.0,0.0,0.0,0.0,1.0
ALERT_212,60.240.216.126,https://lopez.com/,Reflect wish easy religious suffer not.,"Mozilla/5.0 (iPhone; CPU iPhone OS 17_4_1 like Mac OS X) AppleWebKit/531.0 (KHTML, like Gecko) FxiOS/10.2a6189.0 Mobile/40Q206 Safari/531.0",404,Isle of Man,Stored XSS,8,1,37,FP,,3,6,0.0,0.0,0.0,1.0,0.0,1.0,0.0
ALERT_213,213.231.194.33,http://pham.com/,Rich leave reason pressure though.,Mozilla/5.0 (compatible; MSIE 8.0; Windows CE; Trident/3.0),200,Brunei Darussalam,Blind SQLi,9,3,46,FP,,3,6,0.0,1.0,0.0,0.0,0.0,1.0,0.0
ALERT_214,17.179.231.122,https://www.dennis.net/,Break simple opportunity time.,Opera/9.89.(Windows NT 11.0; gu-IN) Presto/2.9.173 Version/12.00,404,Gabon,Blind SQLi,8,3,8,TP,Population get wish join smile.,3,6,0.0,0.0,1.0,0.0,0.0,0.0,1.0
ALERT_215,37.54.218.173,http://oliver.org/,Amount since many begin people project forget.,"Mozilla/5.0 (X11; Linux i686) AppleWebKit/536.0 (KHTML, like Gecko) Chrome/19.0.871.0 Safari/536.0",403,Trinidad and Tobago,Blind SQLi,3,1,6,FP,,3,6,1.0,0.0,0.0,0.0,0.0,0.0,1.0
ALERT_216,22.58.196.119,https://ramos-smith.org/,Back top number policy star.,Mozilla/5.0 (compatible; MSIE 7.0; Windows NT 6.1; Trident/4.0),404,Turkey,Stored XSS,3,2,39,FP,Probably many simply question.,3,6,0.0,0.0,1.0,0.0,0.0,1.0,0.0
ALERT_217,125.59.223.202,http://chase.info/,Son traditional light have however trial.,"Mozilla/5.0 (Windows; U; Windows NT 4.0) AppleWebKit/534.48.4 (KHTML, like Gecko) Version/5.1 Safari/534.48.4",403,Saint Kitts and Nevis,Blind SQLi,8,4,15,FP,Person address doctor artist capital new.,3,6,1.0,0.0,0.0,0.0,1.0,0.0,0.0
ALERT_218,100.226.5.171,https://pierce-shah.com/,These especially design through again next young.,Mozilla/5.0 (compatible; MSIE 6.0; Windows NT 5.01; Trident/4.1),200,Cuba,Blind SQLi,2,1,21,FP,President investment quickly each to.,3,6,0.0,1.0,0.0,0.0,0.0,1.0,0.0
ALERT_219,209.35.102.234,https://www.wilkins.com/,Tell training past data.,Mozilla/5.0 (Windows NT 4.0; kk-KZ; rv:1.9.0.20) Gecko/4681-12-12 11:20:55 Firefox/3.8,404,Tonga,Blind SQLi,8,4,17,FP,,3,6,0.0,1.0,0.0,0.0,1.0,0.0,0.0
ALERT_220,185.65.166.135,http://www.anderson.com/,Special there business economic toward very.,Mozilla/5.0 (compatible; MSIE 7.0; Windows NT 5.01; Trident/4.0),403,Reunion,Stored XSS,1,2,14,TP,,3,6,0.0,0.0,1.0,0.0,1.0,0.0,0.0
ALERT_221,30.15.136.21,http://www.floyd-salazar.com/,Until recognize fly choice.,Opera/9.93.(X11; Linux i686; ps-AF) Presto/2.9.176 Version/11.00,500,Reunion,Blind SQLi,2,4,29,FP,,3,6,1.0,0.0,0.0,0.0,0.0,1.0,0.0
ALERT_222,130.122.9.240,http://www.mckay-sanders.com/,Story write hand fish week hour card should.,"Mozilla/5.0 (iPod; U; CPU iPhone OS 4_3 like Mac OS X; th-TH) AppleWebKit/531.2.6 (KHTML, like Gecko) Version/4.0.5 Mobile/8B117 Safari/6531.2.6",404,Oman,Stored XSS,1,1,43,FP,Possible various cold cell almost project move.,3,6,0.0,0.0,1.0,0.0,0.0,1.0,0.0
ALERT_223,145.97.22.229,http://www.moore.com/,Kind student look how sense member dog.,Mozilla/5.0 (compatible; MSIE 5.0; Windows 98; Trident/3.1),200,Belize,Blind SQLi,8,3,4,TP,Wear thing series arrive stand water senior.,3,6,0.0,0.0,1.0,0.0,0.0,1.0,0.0
ALERT_224,29.120.231.82,http://gardner.com/,Account her since style happen show assume.,Mozilla/5.0 (Android 3.2.4; Mobile; rv:12.0) Gecko/12.0 Firefox/12.0,403,Bosnia and Herzegovina,Blind SQLi,4,2,24,FP,,3,6,0.0,0.0,1.0,0.0,0.0,0.0,1.0
ALERT_225,98.20.25.201,http://www.prince-larson.com/,Seven source or ago place point.,Mozilla/5.0 (X11; Linux i686; rv:1.9.5.20) Gecko/6534-04-26 19:30:35 Firefox/4.0,404,British Virgin Islands,Blind SQLi,5,1,59,FP,Nice indeed project push ready industry much.,3,6,1.0,0.0,0.0,0.0,0.0,1.0,0.0
ALERT_226,45.224.163.2,https://www.schmidt.com/,Security learn ten movie.,Mozilla/5.0 (X11; Linux x86_64; rv:1.9.6.20) Gecko/2784-05-16 19:04:33 Firefox/3.8,404,Western Sahara,Stored XSS,5,1,44,FP,Represent material unit third.,3,6,1.0,0.0,0.0,0.0,0.0,1.0,0.0
ALERT_227,95.121.177.66,http://www.dunn.com/,Parent job see carry.,"Mozilla/5.0 (Macintosh; U; PPC Mac OS X 10_12_6) AppleWebKit/531.0 (KHTML, like Gecko) Chrome/48.0.848.0 Safari/531.0",500,Bouvet Island (Bouvetoya),Stored XSS,4,3,12,FP,,3,6,0.0,1.0,0.0,0.0,1.0,0.0,0.0
ALERT_228,189.244.175.38,http://smith.info/,Run democratic key firm month program.,"Mozilla/5.0 (iPod; U; CPU iPhone OS 3_0 like Mac OS X; is-IS) AppleWebKit/531.6.1 (KHTML, like Gecko) Version/3.0.5 Mobile/8B116 Safari/6531.6.1",404,Reunion,Stored XSS,8,1,58,TP,Former foreign television receive possible loss.,3,6,1.0,0.0,0.0,0.0,0.0,0.0,1.0
ALERT_229,186.246.37.151,http://gomez.com/,Beat peace change call real style.,Mozilla/5.0 (compatible; MSIE 6.0; Windows NT 5.1; Trident/3.0),403,French Guiana,Stored XSS,8,4,39,FP,Available amount partner answer.,3,6,0.0,1.0,0.0,0.0,0.0,1.0,0.0
ALERT_230,110.181.241.235,http://www.irwin.net/,Item it action meeting her visit.,Mozilla/5.0 (compatible; MSIE 5.0; Windows NT 5.2; Trident/5.0),500,Saint Barthelemy,Stored XSS,5,4,17,FP,Key food gun hour involve out southern.,3,6,1.0,0.0,0.0,0.0,0.0,1.0,0.0
ALERT_231,114.128.13.58,https://www.fernandez-garcia.biz/,Themselves write until laugh create.,Opera/9.48.(Windows CE; zh-HK) Presto/2.9.165 Version/10.00,403,Burundi,Stored XSS,7,2,57,FP,,3,6,1.0,0.0,0.0,0.0,1.0,0.0,0.0
ALERT_232,164.96.124.237,http://ford.com/,Pass offer news throughout.,Mozilla/5.0 (compatible; MSIE 5.0; Windows 98; Win 9x 4.90; Trident/4.0),403,Serbia,Blind SQLi,5,1,4,FP,,3,6,1.0,0.0,0.0,0.0,1.0,0.0,0.0
ALERT_233,73.237.196.253,http://martinez.com/,Cell pressure again future new.,Mozilla/5.0 (Windows NT 5.0; nhn-MX; rv:1.9.1.20) Gecko/2310-12-16 04:41:37 Firefox/3.6.13,200,Panama,Blind SQLi,7,4,37,FP,,3,6,0.0,0.0,1.0,0.0,0.0,1.0,0.0
ALERT_234,45.181.115.14,http://byrd-freeman.com/,Style traditional could.,"Mozilla/5.0 (Linux; Android 12) AppleWebKit/532.0 (KHTML, like Gecko) Chrome/45.0.859.0 Safari/532.0",500,Micronesia,Stored XSS,9,1,20,FP,,3,6,1.0,0.0,0.0,0.0,0.0,1.0,0.0
ALERT_235,44.254.75.165,http://jones.com/,Occur really spend. Human position build alone.,Mozilla/5.0 (Macintosh; U; PPC Mac OS X 10_6_7; rv:1.9.2.20) Gecko/5644-09-06 11:23:39 Firefox/3.6.11,500,Montenegro,Stored XSS,5,3,2,FP,,3,6,0.0,1.0,0.0,0.0,1.0,0.0,0.0
ALERT_236,64.141.58.197,https://flores-sherman.com/,For theory true read.,"Mozilla/5.0 (Linux; Android 2.2.1) AppleWebKit/531.1 (KHTML, like Gecko) Chrome/52.0.813.0 Safari/531.1",403,Gabon,Stored XSS,4,1,18,FP,,3,6,0.0,0.0,0.0,1.0,0.0,1.0,0.0
ALERT_237,137.218.237.250,https://brown-williams.com/,Treat on make it tax shoulder prepare.,"Mozilla/5.0 (Macintosh; Intel Mac OS X 10_10_1 rv:2.0; ff-SN) AppleWebKit/532.30.1 (KHTML, like Gecko) Version/5.1 Safari/532.30.1",403,Bahamas,Blind SQLi,8,4,51,TP,Hot economic send.,3,6,1.0,0.0,0.0,0.0,0.0,0.0,1.0
ALERT_238,39.95.220.198,http://leonard-curtis.com/,Indicate well staff option seem bill our.,"Mozilla/5.0 (Linux; Android 4.2.2) AppleWebKit/535.0 (KHTML, like Gecko) Chrome/37.0.882.0 Safari/535.0",403,Guatemala,Blind SQLi,1,1,12,FP,Two leave bring out may cut billion.,3,6,0.0,0.0,1.0,0.0,1.0,0.0,0.0
ALERT_239,198.185.206.73,https://www.hess.info/,They real woman mean truth after chance.,Mozilla/5.0 (compatible; MSIE 8.0; Windows NT 6.0; Trident/4.1),404,Egypt,Blind SQLi,3,2,49,FP,Anyone win type listen follow.,3,6,1.0,0.0,0.0,0.0,1.0,0.0,0.0
ALERT_240,175.141.105.37,https://www.howard.biz/,Give shoulder security brother admit.,Mozilla/5.0 (X11; Linux x86_64; rv:1.9.7.20) Gecko/8284-02-01 20:08:27 Firefox/3.6.9,200,Ukraine,Blind SQLi,5,4,23,FP,,4,6,1.0,0.0,0.0,0.0,1.0,0.0,0.0
ALERT_241,52.148.1.138,http://www.anderson.biz/,Prove Congress moment.,Opera/8.33.(X11; Linux i686; ig-NG) Presto/2.9.171 Version/12.00,200,Macao,Blind SQLi,7,1,32,TP,,4,6,0.0,1.0,0.0,0.0,1.0,0.0,0.0
ALERT_242,110.102.163.69,http://www.jones-young.com/,Office computer natural art moment.,Mozilla/5.0 (compatible; MSIE 5.0; Windows NT 5.01; Trident/5.0),403,Pakistan,Stored XSS,7,4,1,FP,Certainly happen medical soon pay.,4,6,1.0,0.0,0.0,0.0,0.0,1.0,0.0
ALERT_243,66.157.172.9,http://reeves-montgomery.biz/,Mrs skill beautiful receive final fish clearly.,"Mozilla/5.0 (Windows; U; Windows NT 4.0) AppleWebKit/531.6.5 (KHTML, like Gecko) Version/4.0 Safari/531.6.5",200,Equatorial Guinea,Stored XSS,4,1,23,FP,,4,6,0.0,0.0,1.0,0.0,0.0,0.0,1.0
ALERT_244,95.207.113.197,https://hebert.com/,Attack financial main Mr six.,"Mozilla/5.0 (Macintosh; PPC Mac OS X 10_12_0 rv:4.0; el-CY) AppleWebKit/531.37.5 (KHTML, like Gecko) Version/4.0.3 Safari/531.37.5",200,Gambia,Blind SQLi,7,2,5,FP,Environmental woman whatever modern grow course stay training.,4,6,0.0,1.0,0.0,0.0,0.0,1.0,0.0
ALERT_245,62.156.43.198,https://www.humphrey.com/,Political create responsibility contain.,"Mozilla/5.0 (Macintosh; U; Intel Mac OS X 10_12_8 rv:6.0; tk-TM) AppleWebKit/534.17.1 (KHTML, like Gecko) Version/4.1 Safari/534.17.1",404,Poland,Stored XSS,3,4,40,FP,,4,6,1.0,0.0,0.0,0.0,0.0,0.0,1.0
ALERT_246,123.13.148.162,https://www.houston.com/,Television analysis impact various not term.,Mozilla/5.0 (compatible; MSIE 9.0; Windows NT 6.1; Trident/3.1),200,Paraguay,Stored XSS,7,2,32,TP,Sense training analysis collection high skill begin.,4,6,0.0,0.0,0.0,1.0,0.0,1.0,0.0
ALERT_247,135.122.129.69,http://www.king.com/,Every travel down exactly.,Mozilla/5.0 (Windows NT 10.0; sat-IN; rv:1.9.1.20) Gecko/8290-09-20 06:35:39 Firefox/3.8,200,Somalia,Blind SQLi,7,4,3,FP,,4,6,0.0,0.0,0.0,1.0,1.0,0.0,0.0
ALERT_248,152.46.3.49,https://www.huynh.biz/,Expect whether reality campaign apply less vote.,Opera/9.24.(Windows NT 6.2; br-FR) Presto/2.9.190 Version/10.00,200,Palau,Blind SQLi,5,1,31,TP,,4,6,0.0,0.0,1.0,0.0,0.0,0.0,1.0
ALERT_249,148.4.44.25,http://www.vasquez-harris.com/,Despite son accept collection policy top both.,Opera/9.97.(Windows NT 5.01; mai-IN) Presto/2.9.163 Version/10.00,200,Montserrat,Stored XSS,1,1,31,FP,,4,6,0.0,0.0,1.0,0.0,1.0,0.0,0.0
ALERT_250,167.142.152.85,http://garcia.com/,Action such reality paper official game.,Mozilla/5.0 (compatible; MSIE 8.0; Windows NT 6.0; Trident/4.1),500,Albania,Stored XSS,3,3,9,FP,,4,6,1.0,0.0,0.0,0.0,0.0,0.0,1.0
ALERT_251,167.78.39.208,http://www.david.com/,Whom choice sit figure nothing play.,"Mozilla/5.0 (Macintosh; U; PPC Mac OS X 10_9_0) AppleWebKit/535.0 (KHTML, like Gecko) Chrome/42.0.834.0 Safari/535.0",200,Vietnam,Stored XSS,1,2,47,FP,Resource lawyer hospital within positive.,4,6,0.0,0.0,1.0,0.0,1.0,0.0,0.0
ALERT_252,195.196.161.148,http://cummings-evans.com/,Past network minute try account.,"Mozilla/5.0 (Windows; U; Windows NT 5.01) AppleWebKit/534.37.3 (KHTML, like Gecko) Version/5.0.2 Safari/534.37.3",200,Pakistan,Blind SQLi,6,4,11,FP,First when computer moment.,4,6,0.0,0.0,0.0,1.0,0.0,1.0,0.0
ALERT_253,89.156.182.220,http://www.gonzalez.com/,Each laugh pass clearly visit rule.,"Mozilla/5.0 (Macintosh; Intel Mac OS X 10_6_8) AppleWebKit/535.1 (KHTML, like Gecko) Chrome/54.0.867.0 Safari/535.1",200,Nigeria,Blind SQLi,9,1,1,FP,Easy help thousand democratic example bank.,4,6,0.0,0.0,0.0,1.0,1.0,0.0,0.0
ALERT_254,221.143.73.30,https://www.green-ross.com/,Sometimes will executive image child.,Opera/8.51.(Windows NT 11.0; pl-PL) Presto/2.9.170 Version/12.00,403,Dominican Republic,Stored XSS,8,2,17,FP,,4,6,1.0,0.0,0.0,0.0,0.0,1.0,0.0
ALERT_255,180.244.82.89,http://www.martin-williams.com/,A way ability admit simply one share collection.,Mozilla/5.0 (compatible; MSIE 6.0; Windows 98; Trident/5.0),200,North Macedonia,Stored XSS,4,3,21,TP,Possible husband region participant half.,4,6,0.0,0.0,1.0,0.0,0.0,1.0,0.0
ALERT_256,138.34.109.52,http://www.price.com/,Ever memory other place building.,Mozilla/5.0 (compatible; MSIE 9.0; Windows NT 5.2; Trident/4.0),500,Micronesia,Blind SQLi,6,3,56,FP,Find visit service improve per standard difference.,4,6,0.0,0.0,1.0,0.0,1.0,0.0,0.0
ALERT_257,55.179.205.16,https://mcbride.net/,Under camera film note sell.,Mozilla/5.0 (compatible; MSIE 9.0; Windows NT 10.0; Trident/3.1),404,Colombia,Stored XSS,1,4,10,TP,Garden team animal important reflect structure.,4,6,0.0,1.0,0.0,0.0,1.0,0.0,0.0
ALERT_258,131.67.85.90,http://simpson-weber.com/,Trade reduce anything.,Mozilla/5.0 (Windows NT 10.0; ayc-PE; rv:1.9.2.20) Gecko/8894-05-19 15:36:04 Firefox/9.0,403,Bulgaria,Blind SQLi,5,4,36,TP,,4,6,1.0,0.0,0.0,0.0,0.0,0.0,1.0
ALERT_259,196.176.120.12,https://white-stewart.com/,White away guess suggest nearly.,"Mozilla/5.0 (Windows; U; Windows NT 6.0) AppleWebKit/531.47.6 (KHTML, like Gecko) Version/4.0.5 Safari/531.47.6",403,Singapore,Stored XSS,9,2,1,TP,Person measure share by whatever miss lay.,4,6,0.0,0.0,0.0,1.0,1.0,0.0,0.0
ALERT_260,79.33.140.203,https://www.jones.info/,Current street cover foot modern wear.,"Mozilla/5.0 (Macintosh; U; PPC Mac OS X 10_12_2 rv:5.0; ug-CN) AppleWebKit/533.13.4 (KHTML, like Gecko) Version/4.0.5 Safari/533.13.4",403,Syrian Arab Republic,Stored XSS,3,3,14,FP,Finish window fund economy run leave smile.,4,6,0.0,1.0,0.0,0.0,0.0,1.0,0.0
ALERT_261,59.16.93.125,https://fernandez-hernandez.com/,Care agree where style including.,"Mozilla/5.0 (Macintosh; Intel Mac OS X 10_8_7) AppleWebKit/532.2 (KHTML, like Gecko) Chrome/39.0.801.0 Safari/532.2",200,Sweden,Stored XSS,3,2,57,TP,,4,6,0.0,1.0,0.0,0.0,0.0,1.0,0.0
ALERT_262,7.86.164.123,http://johnson.org/,Into game participant give.,Mozilla/5.0 (compatible; MSIE 7.0; Windows NT 6.1; Trident/3.1),403,Bouvet Island (Bouvetoya),Blind SQLi,6,2,13,FP,Skill whose size peace.,4,6,0.0,1.0,0.0,0.0,1.0,0.0,0.0
ALERT_263,86.199.217.155,http://galvan.com/,Open president nature side.,"Mozilla/5.0 (Linux; Android 2.3.7) AppleWebKit/534.0 (KHTML, like Gecko) Chrome/45.0.835.0 Safari/534.0",500,Bahamas,Blind SQLi,6,3,23,FP,Movie computer employee hospital.,4,6,0.0,0.0,1.0,0.0,1.0,0.0,0.0
ALERT_264,44.61.205.80,https://wilson-scott.com/,Treat hot capital strong apply.,Opera/9.14.(X11; Linux x86_64; en-SG) Presto/2.9.176 Version/11.00,403,Solomon Islands,Blind SQLi,6,1,9,TP,,4,6,1.0,0.0,0.0,0.0,0.0,0.0,1.0
ALERT_265,122.142.147.43,https://jones-munoz.com/,Should animal continue because special.,"Mozilla/5.0 (Windows; U; Windows NT 6.0) AppleWebKit/531.18.1 (KHTML, like Gecko) Version/5.0 Safari/531.18.1",500,Austria,Stored XSS,9,3,3,TP,,4,6,0.0,1.0,0.0,0.0,0.0,1.0,0.0
ALERT_266,69.16.101.65,https://bennett.org/,Follow street past. Recent agent those billion.,"Mozilla/5.0 (iPad; CPU iPad OS 1_1_5 like Mac OS X) AppleWebKit/531.0 (KHTML, like Gecko) CriOS/60.0.891.0 Mobile/88V118 Safari/531.0",403,Cameroon,Blind SQLi,2,4,21,FP,Question him partner less.,4,6,0.0,0.0,1.0,0.0,0.0,1.0,0.0
ALERT_267,147.23.32.42,https://www.hogan-riddle.org/,Exist before fast medical mission seem.,"Mozilla/5.0 (Windows; U; Windows NT 5.1) AppleWebKit/533.29.5 (KHTML, like Gecko) Version/4.0.2 Safari/533.29.5",200,Fiji,Blind SQLi,6,2,21,FP,Newspaper his heart exist.,4,6,0.0,1.0,0.0,0.0,1.0,0.0,0.0
ALERT_268,56.16.161.179,https://www.sanders.com/,Defense trip behavior kind.,"Mozilla/5.0 (Linux; Android 3.2.3) AppleWebKit/536.2 (KHTML, like Gecko) Chrome/52.0.898.0 Safari/536.2",404,Fiji,Stored XSS,5,4,40,FP,New life able find book now news dog.,4,6,0.0,0.0,0.0,1.0,0.0,1.0,0.0
ALERT_269,21.22.75.249,https://shaw.biz/,Group thank year seek kitchen or.,"Mozilla/5.0 (iPad; CPU iPad OS 7_1_2 like Mac OS X) AppleWebKit/531.0 (KHTML, like Gecko) CriOS/16.0.873.0 Mobile/26I695 Safari/531.0",404,Japan,Stored XSS,3,1,27,FP,Choice experience travel baby happen become.,4,6,0.0,1.0,0.0,0.0,1.0,0.0,0.0
ALERT_270,158.194.228.159,https://www.nash-moore.info/,Rise cut collection something face card firm.,Mozilla/5.0 (Android 10; Mobile; rv:15.0) Gecko/15.0 Firefox/15.0,403,Monaco,Blind SQLi,2,4,2,TP,,4,6,1.0,0.0,0.0,0.0,0.0,1.0,0.0
ALERT_271,13.19.136.104,http://www.spencer.info/,Radio must central sea public.,Opera/9.54.(Windows NT 6.0; ve-ZA) Presto/2.9.180 Version/10.00,404,Greece,Blind SQLi,6,3,1,FP,,4,6,1.0,0.0,0.0,0.0,0.0,0.0,1.0
ALERT_272,21.203.122.57,http://fox.biz/,Painting painting movie.,Mozilla/5.0 (compatible; MSIE 7.0; Windows NT 5.01; Trident/5.0),500,Ghana,Stored XSS,5,3,2,FP,,4,6,0.0,1.0,0.0,0.0,0.0,0.0,1.0
ALERT_273,217.188.82.229,http://www.roberts.com/,Owner once smile begin.,Opera/8.73.(Windows NT 5.1; or-IN) Presto/2.9.172 Version/11.00,500,Kiribati,Blind SQLi,1,2,48,FP,,4,6,0.0,1.0,0.0,0.0,1.0,0.0,0.0
ALERT_274,212.141.13.49,https://swanson-hood.com/,Relate American show box movement add full.,"Mozilla/5.0 (Macintosh; U; PPC Mac OS X 10_11_6 rv:2.0; kn-IN) AppleWebKit/534.38.7 (KHTML, like Gecko) Version/4.1 Safari/534.38.7",404,Guernsey,Blind SQLi,2,2,21,FP,,4,6,0.0,1.0,0.0,0.0,0.0,0.0,1.0
ALERT_275,46.64.162.238,https://strong.com/,Foreign dinner charge improve Mrs.,"Mozilla/5.0 (Macintosh; Intel Mac OS X 10_8_2 rv:3.0; hne-IN) AppleWebKit/535.15.5 (KHTML, like Gecko) Version/5.1 Safari/535.15.5",500,Syrian Arab Republic,Blind SQLi,1,4,55,TP,,4,6,0.0,1.0,0.0,0.0,0.0,0.0,1.0
ALERT_276,133.76.42.176,http://myers.net/,City official inside charge measure rock.,Mozilla/5.0 (compatible; MSIE 8.0; Windows 98; Trident/5.0),500,Haiti,Blind SQLi,9,1,19,FP,Must turn air hundred car food collection.,4,6,0.0,1.0,0.0,0.0,0.0,0.0,1.0
ALERT_277,20.103.174.213,http://www.thomas-perez.net/,Rest suddenly participant instead course.,"Mozilla/5.0 (Windows; U; Windows NT 4.0) AppleWebKit/531.33.6 (KHTML, like Gecko) Version/5.1 Safari/531.33.6",404,Burkina Faso,Blind SQLi,4,3,32,FP,Gas among process.,4,6,0.0,0.0,0.0,1.0,1.0,0.0,0.0
ALERT_278,108.151.55.171,http://solomon.net/,Energy partner letter thank run each.,Opera/9.92.(X11; Linux i686; gv-GB) Presto/2.9.186 Version/10.00,403,Vietnam,Blind SQLi,4,3,2,FP,,4,6,1.0,0.0,0.0,0.0,0.0,1.0,0.0
ALERT_279,137.175.230.91,https://www.lowe.biz/,Draw guy cold anyone. Must let own.,Opera/9.81.(X11; Linux i686; apn-IN) Presto/2.9.186 Version/12.00,500,British Indian Ocean Territory (Chagos Archipelago),Blind SQLi,1,1,29,FP,Practice less somebody back fear once.,4,6,1.0,0.0,0.0,0.0,1.0,0.0,0.0
ALERT_280,64.0.249.91,https://www.murray.com/,Stand entire recognize person wife opportunity.,"Mozilla/5.0 (Windows; U; Windows NT 10.0) AppleWebKit/534.1.5 (KHTML, like Gecko) Version/4.0 Safari/534.1.5",200,Western Sahara,Stored XSS,4,2,45,FP,,4,6,0.0,1.0,0.0,0.0,0.0,0.0,1.0
ALERT_281,218.70.201.229,https://www.morris.info/,Team share or term sing.,Mozilla/5.0 (Windows NT 5.2; brx-IN; rv:1.9.1.20) Gecko/9069-08-26 05:15:32 Firefox/15.0,403,Turkey,Blind SQLi,6,3,18,FP,Power order Democrat treat any.,4,6,0.0,0.0,0.0,1.0,1.0,0.0,0.0
ALERT_282,110.1.22.103,http://www.martinez-garcia.com/,They various describe sell.,"Mozilla/5.0 (Linux; Android 2.3) AppleWebKit/536.0 (KHTML, like Gecko) Chrome/16.0.839.0 Safari/536.0",404,Iran,Stored XSS,6,3,33,FP,,4,6,1.0,0.0,0.0,0.0,1.0,0.0,0.0
ALERT_283,136.167.144.52,https://wiggins.com/,Final pay material relationship war join.,"Mozilla/5.0 (Macintosh; U; Intel Mac OS X 10_12_5) AppleWebKit/534.2 (KHTML, like Gecko) Chrome/41.0.818.0 Safari/534.2",200,Maldives,Stored XSS,7,3,22,TP,Example add feeling off rule whatever.,4,6,0.0,0.0,0.0,1.0,0.0,1.0,0.0
ALERT_284,42.194.105.133,http://www.glover.net/,Which his just both.,Mozilla/5.0 (Android 4.4.2; Mobile; rv:8.0) Gecko/8.0 Firefox/8.0,500,Maldives,Stored XSS,4,2,40,TP,,4,6,0.0,0.0,0.0,1.0,1.0,0.0,0.0
ALERT_285,188.14.42.110,https://mack-shaw.org/,Human team catch. Common human relate leg large.,"Mozilla/5.0 (iPod; U; CPU iPhone OS 3_3 like Mac OS X; szl-PL) AppleWebKit/533.29.4 (KHTML, like Gecko) Version/4.0.5 Mobile/8B118 Safari/6533.29.4",200,Poland,Blind SQLi,1,3,38,TP,Use million same race director Republican.,4,6,0.0,0.0,0.0,1.0,1.0,0.0,0.0
ALERT_286,183.217.220.183,http://www.mccoy-delacruz.com/,Change camera continue clearly make mouth.,"Mozilla/5.0 (iPod; U; CPU iPhone OS 4_3 like Mac OS X; so-KE) AppleWebKit/532.29.1 (KHTML, like Gecko) Version/3.0.5 Mobile/8B115 Safari/6532.29.1",404,Kenya,Blind SQLi,9,1,44,FP,,4,6,1.0,0.0,0.0,0.0,1.0,0.0,0.0
ALERT_287,77.123.107.15,https://www.jones-burke.com/,Stage good hit pretty television wind discussion.,"Mozilla/5.0 (X11; Linux x86_64) AppleWebKit/532.2 (KHTML, like Gecko) Chrome/35.0.838.0 Safari/532.2",500,Saint Kitts and Nevis,Stored XSS,3,4,41,FP,,4,6,0.0,1.0,0.0,0.0,1.0,0.0,0.0
ALERT_288,136.195.222.56,https://skinner.net/,Perform positive goal now.,Opera/9.76.(X11; Linux x86_64; crh-UA) Presto/2.9.168 Version/10.00,403,Liechtenstein,Stored XSS,4,1,14,TP,,4,6,1.0,0.0,0.0,0.0,0.0,0.0,1.0
ALERT_289,44.209.78.200,http://willis-turner.com/,Special sea company weight every.,Mozilla/5.0 (compatible; MSIE 6.0; Windows 98; Trident/5.0),404,Jamaica,Stored XSS,9,1,14,FP,Blue positive certainly thing recently.,4,6,0.0,1.0,0.0,0.0,0.0,1.0,0.0
ALERT_290,74.10.214.88,https://brown.com/,About college morning ever.,Opera/8.44.(X11; Linux x86_64; dz-BT) Presto/2.9.160 Version/10.00,404,Czech Republic,Blind SQLi,6,1,2,FP,,4,6,0.0,0.0,1.0,0.0,1.0,0.0,0.0
ALERT_291,163.185.219.47,http://williams-walton.com/,Present main top.,Opera/9.85.(X11; Linux x86_64; vi-VN) Presto/2.9.177 Version/11.00,403,Japan,Blind SQLi,4,3,6,FP,Probably interesting success social wear participant here.,4,6,0.0,0.0,1.0,0.0,0.0,0.0,1.0
